Unnamed: 0,show_id,type,title,director,cast,country,date_added,release_year,rating,duration,listed_in,description,Title,Genre,Premiere,Runtime,IMDB Score,Language,is_original
115,s116,Movie,Bright Star,Jane Campion,"Abbie Cornish, Ben Whishaw, Paul Schneider, Kerry Fox, Edie Martin, Thomas Brodie-Sangster, Claudie Blakley, Gerard Monaco, Antonia Campbell-Hughes, Samuel Roukin","United Kingdom, Australia, France","September 2, 2021",2009,PG,119 min,"Dramas, Romantic Movies",This drama details the passionate three-year romance between Romantic poet John Keats – who died tragically at age 25 – and his great love and muse.,Mute,Science fiction/Mystery,"February 23, 2018",126,5.5,English,True
117,s118,Movie,Final Account,Luke Holland,Unknown,"United Kingdom, United States","September 2, 2021",2021,PG-13,No data,Documentaries,This documentary stitches together never-before-seen interviews with the last living generation of people who participated in Hitler's Third Reich.,Red Dot,Thriller,"February 11, 2021",86,5.5,Swedish,True
118,s119,Movie,Gurgaon,Shanker Raman,"Akshay Oberoi, Pankaj Tripathi, Ragini Khanna, Aamir Bashir, Shalini Vatsa, Ashish Verma",India,"September 2, 2021",2017,TV-14,No data,"Dramas, International Movies, Thrillers","When the daughter of a wealthy family returns from college, she gets a frosty welcome from her brother, who has problems – and plans – of his own.",Ride or Die,Psychological thriller drama,"April 15, 2021",142,5.5,Japanese,True
119,s120,Movie,Here and There,JP Habac,"Janine Gutierrez, JC Santos, Victor Anastacio, Yesh Burce, Lotlot De Leon",Unknown,"September 2, 2021",2020,TV-MA,No data,"Dramas, International Movies, Romantic Movies","After meeting through a heated exchange on social media, two people with different backgrounds begin an online romance in the midst of a pandemic.",Step Sisters,Comedy,"January 19, 2018",108,5.5,English,True
120,s121,TV Show,Heroes of Goo Jit Zu,Unknown,"Jon Allen, Kellen Goff, Joe Hernandez, Kaiji Tang",Australia,"September 2, 2021",2021,TV-Y7,No data,"Kids' TV, TV Comedies","After a meteor crash, a group of zoo animals transforms into squishy, gooey and stretchy superheroes with special powers and soon takes on evildoers.",The Cloverfield Paradox,Science fiction,"February 4, 2018",102,5.5,English,True
121,s122,TV Show,Hotel Del Luna,Unknown,"Lee Ji-eun, Yeo Jin-goo, Shin Jung-geun, Seo Yi-sook, Bae Hae-sun, Pyo Ji-hoon, Cho Hyun-chul, Kang Hong-suk, Lee Do-hyun, Lee Tae-seon, Kang Mina, Park You-na, Oh Ji-ho",Unknown,"September 2, 2021",2019,TV-14,No data,"International TV Shows, Romantic TV Shows, TV Comedies","When he's invited to manage a hotel for dead souls, an elite hotelier gets to know the establishment's ancient owner and her strange world.",The Knight Before Christmas,Romantic comedy,"November 21, 2019",92,5.5,English,True
122,s123,Movie,In the Cut,Jane Campion,"Meg Ryan, Mark Ruffalo, Jennifer Jason Leigh, Nick Damici, Sharrieff Pugh, Kevin Bacon, Yaani King Mondschein, Heather Litteer","United Kingdom, Australia, France, United States","September 2, 2021",2003,R,118 min,Thrillers,"After embarking on an affair with the cop probing the murder of a young woman, an insular schoolteacher suspects her lover was involved in the crime.",The Legacy of a Whitetail Deer Hunter,Adventure/Comedy,"July 6, 2018",83,5.5,English,True
123,s124,TV Show,Luv Kushh,Unknown,Unknown,Unknown,"September 2, 2021",2012,TV-Y7,No data,Kids' TV,"Based on the last book of the epic Ramayana, this series follows the endeavors and adventures of Lord Rama’s twin sons through their childhood.",The Package,Black comedy,"August 10, 2018",94,5.5,English,True
124,s125,TV Show,Pororo - The Little Penguin,Unknown,Unknown,South Korea,"September 2, 2021",2013,TV-Y7,No data,"Kids' TV, Korean TV Shows","On a tiny island, Pororo the penguin has fun adventures with his friends Eddy the fox, Loopy the beaver, Poby the polar bear and Crong the dinosaur.",Unicorn Store,Comedy,"April 5, 2019",92,5.5,English,True
125,s126,TV Show,Q-Force,Unknown,"Sean Hayes, Wanda Sykes, Laurie Metcalf, David Harbour, Gary Cole, Patti Harrison, Matt Rogers",United States,"September 2, 2021",2021,TV-MA,No data,"Crime TV Shows, TV Action & Adventure, TV Comedies","A gay superspy and his scrappy LGBTQ squad fight to prove themselves to the agency that underestimated them. Today, West Hollywood… tomorrow, the world!",Wine Country,Comedy,"May 10, 2019",103,5.5,English,True
126,s127,Movie,Shikara,Vidhu Vinod Chopra,"Aadil Khan, Sadia Khateeb, Zain Khan Durrani, Priyanshu Chatterjee, Bhavna Chauhan, Ashwin Dhar, Farid Azad Khan, Saghar Sehrai",India,"September 2, 2021",2020,TV-14,No data,"Dramas, International Movies, Romantic Movies",A couple must strive to remain resilient after regional hostilities drive them from their beloved home into a refugee camp.,Bomb Scared,Black comedy,"October 12, 2017",89,5.6,Spanish/Basque,True
127,s128,Movie,A Cinderella Story,Mark Rosman,"Hilary Duff, Chad Michael Murray, Jennifer Coolidge, Dan Byrd, Regina King, Julie Gonzalo, Lin Shaye, Madeline Zima, Andrea Avery, Mary Pat Gleason, Paul Rodriguez, Whip Hubley, Kevin Kilner, Erica Hubbard, Simon Helberg","United States, Canada","September 1, 2021",2004,PG,No data,"Children & Family Movies, Comedies",Teen Sam meets the boy of her dreams at a dance before returning to toil in her stepmother's diner. Can her lost cell phone bring them together?,Brahman Naman,Comedy,"July 7, 2016",95,5.6,English,True
128,s129,Movie,Agatha Christie's Crooked House,Gilles Paquet-Brenner,"Glenn Close, Terence Stamp, Max Irons, Gillian Anderson, Christina Hendricks, Stefanie Martini, Julian Sands, Honor Kneafsey, Christian McKay, Amanda Abbington",Unknown,"September 1, 2021",2017,PG-13,No data,"Dramas, International Movies, Thrillers","When a detective investigates the death of his ex-lover's grandfather, he uncovers secrets about the tycoon's manipulative family.",Double Dad,Comedy-drama,"January 15, 2021",103,5.6,Portuguese,True
129,s130,Movie,An Unfinished Life,Lasse Hallström,"Robert Redford, Jennifer Lopez, Morgan Freeman, Josh Lucas, Damian Lewis, Camryn Manheim, Becca Gardner, Lynda Boyd, Rob Hayter, P. Lynn Johnson","Germany, United States","September 1, 2021",2005,PG-13,No data,Dramas,"A grieving widow and her daughter move in with her estranged father-in-law in Wyoming, where time allows them to heal and forgive.",Falling Inn Love,Romantic comedy,"August 29, 2019",97,5.6,English,True
130,s131,Movie,Barbie Big City Big Dreams,Scott Pleydell-Pearce,"America Young, Amber May, Giselle Fernandez, Alejandro Saab, Dinora Walcott",Unknown,"September 1, 2021",2021,TV-Y,63 min,"Children & Family Movies, Music & Musicals","At a summer performing arts program in New York City, Barbie from Malibu meets Barbie from Brooklyn, and the two become fast friends.",Hold the Dark,Thriller,"September 28, 2018",125,5.6,English,True
131,s132,Movie,Blade Runner: The Final Cut,Ridley Scott,"Harrison Ford, Rutger Hauer, Sean Young, Edward James Olmos, M. Emmet Walsh, Daryl Hannah, William Sanderson, Brion James, Joe Turkel, Joanna Cassidy, James Hong, Morgan Paull",United States,"September 1, 2021",1982,R,117 min,"Action & Adventure, Classic Movies, Cult Movies","In a smog-choked dystopian Los Angeles, blade runner Rick Deckard is called out of retirement to snuff a quartet of escaped ""replicants.""","Love, Guaranteed",Romantic comedy,"September 3, 2020",91,5.6,English,True
132,s133,TV Show,Brave Animated Series,Unknown,"Tseng Yun-fan, Kao Yun-shuo, Chiang Ching-yen, Meng Ching-fu, Huang Bai-wei, Ma Kuo-yao, Chen Yen-chun, Sun Ke-fang, Kai Yang-niu, Chen Yu-wen, Nick Liao, Lin Kai-ling, Mickey Huang, Liu Kuan-ting, Jiang Du-hui",Unknown,"September 1, 2021",2021,TV-MA,No data,"International TV Shows, TV Action & Adventure, TV Comedies",A group of superheroes sets out to rid the world of evil — only to realize they may not be standing on the side of justice. Based on a popular comic.,One-Way to Tomorrow,Romance,"June 19, 2020",90,5.6,Turkish,True
133,s134,Movie,Chappie,Neill Blomkamp,"Sharlto Copley, Hugh Jackman, Sigourney Weaver, Dev Patel, Ninja, Yo-Landi Visser, Jose Pablo Cantillo, Brandon Auret, Johnny Selema, Maurice Carpede","South Africa, United States","September 1, 2021",2015,R,121 min,"Action & Adventure, Sci-Fi & Fantasy","In a futuristic society where an indestructible robot police force keeps crime at bay, a lone droid evolves to the next level of artificial intelligence.",Sarah Cooper: Everything's Fine,Variety show,"October 27, 2020",49,5.6,English,True
134,s135,Movie,Clear and Present Danger,Phillip Noyce,"Harrison Ford, Willem Dafoe, Anne Archer, Joaquim de Almeida, Henry Czerny, Harris Yulin, Donald Moffat, Miguel Sandoval, Benjamin Bratt, Dean Jones, Thora Birch, James Earl Jones, Raymond Cruz","United States, Mexico","September 1, 2021",1994,PG-13,142 min,"Action & Adventure, Dramas","When the president's friend is murdered, CIA Deputy Director Jack Ryan becomes unwittingly involved in an illegal war against a Colombian drug cartel.",The Last Laugh,Comedy-drama,"January 11, 2019",98,5.6,English,True
135,s136,Movie,Cliffhanger,Renny Harlin,"Sylvester Stallone, John Lithgow, Michael Rooker, Janine Turner, Rex Linn, Caroline Goodall, Leon, Craig Fairbrass, Ralph Waite, Max Perlich, Paul Winfield","United States, Italy, France, Japan","September 1, 2021",1993,R,113 min,Action & Adventure,"Ranger Gabe Walker and his partner are called to rescue a group of stranded climbers, only to learn the climbers are actually thieving hijackers.",The Last Paradiso,Romantic drama,"February 5, 2021",107,5.6,Italian,True
136,s137,Movie,Cold Mountain,Anthony Minghella,"Jude Law, Nicole Kidman, Renée Zellweger, Eileen Atkins, Brendan Gleeson, Philip Seymour Hoffman, Natalie Portman, Giovanni Ribisi, Donald Sutherland, Ray Winstone","United States, Italy, Romania, United Kingdom","September 1, 2021",2003,R,154 min,"Dramas, Romantic Movies","This drama follows a wounded Civil War soldier making the long journey home, while his faraway love fights for survival on her deceased father's farm.",The Midnight Sky,Science fiction,"December 23, 2020",118,5.6,English,True
137,s138,Movie,Crocodile Dundee in Los Angeles,Simon Wincer,"Paul Hogan, Linda Kozlowski, Jere Burns, Jonathan Banks, Aida Turturro, Alec Wilson, Gerry Skilton, Steve Rackman, Serge Cockburn, Paul Rodriguez, Mark Adair-Rios, Tiriel Mora, Grant Piro, Mike Tyson","Australia, United States","September 1, 2021",2001,PG,No data,"Action & Adventure, Comedies","When Mick ""Crocodile"" Dundee and his family land in Los Angeles, they soon learn some lessons about American life in this comedy sequel.",The Paramedic,Thriller,"September 16, 2020",94,5.6,Spanish,True
138,s139,Movie,Dear John,Lasse Hallström,"Channing Tatum, Amanda Seyfried, Richard Jenkins, Henry Thomas, D.J. Cotrona, Cullen Moss, Gavin McCulley, Jose Lucena Jr., Keith Robinson, Scott Porter",United States,"September 1, 2021",2010,PG-13,No data,"Dramas, Romantic Movies","While on summer leave, a U.S. soldier falls for a college student. But when he's forced to reenlist, their handwritten letters hold the lovers together.",The Sleepover,Comedy,"August 21, 2020",103,5.6,English,True
139,s140,Movie,Do the Right Thing,Spike Lee,"Danny Aiello, Ossie Davis, Ruby Dee, Richard Edson, Giancarlo Esposito, Spike Lee, Bill Nunn, John Turturro, Paul Benjamin, Frankie Faison, Samuel L. Jackson, Rosie Perez, Martin Lawrence, Miguel Sandoval",United States,"September 1, 2021",1989,R,120 min,"Classic Movies, Comedies, Dramas","On a sweltering day in Brooklyn, simmering racial tensions between residents rise to the surface and ignite rage, violence and tragedy.",Vampires vs. the Bronx,Horror comedy,"October 2, 2020",86,5.6,English,True
140,s141,Movie,"El patrón, radiografía de un crimen",Sebastián Schindel,"Joaquín Furriel, Luis Ziembrowski, Guillermo Pfening, Mónica Lairana, Germán de Silva, Victoria Raposo, Andrea Garrote","Argentina, Venezuela","September 1, 2021",2014,TV-MA,No data,"Dramas, International Movies, Thrillers",A lawyer defends an illiterate man whose exploitation by a cruel boss while working as a butcher in Buenos Aires led to tragedy. Based on a true case.,Why Did You Kill Me?,Documentary,"April 14, 2021",83,5.6,English,True
141,s142,Movie,Extraction,Steven C. Miller,"Bruce Willis, Kellan Lutz, Gina Carano, D.B. Sweeney, Joshua Mikel, Steve Coulter, Dan Bilzerian, Heather Johansen","United States, United Kingdom, Canada","September 1, 2021",2015,R,82 min,Action & Adventure,"When a retired CIA agent is kidnapped, his son, a government analyst, embarks on an unauthorized mission to find him and halt a terrorist plot.",A Week Away,Christian musical,"March 26, 2021",97,5.7,English,True
142,s143,Movie,Freedom Writers,Richard LaGravenese,"Hilary Swank, Patrick Dempsey, Scott Glenn, Imelda Staunton, April L. Hernandez, Mario, Kristin Herrera, Jaclyn Ngan, Sergio Montalvo, Jason Finn, Deance Wyatt, Vanetta Smith","Germany, United States","September 1, 2021",2007,PG-13,124 min,Dramas,"While her at-risk students are reading classics such as ""The Diary of Anne Frank,"" a teacher asks them to keep journals about their troubled lives.",Caught by a Wave,Romantic teen drama,"March 25, 2021",99,5.7,Italian,True
143,s144,Movie,Green Lantern,Martin Campbell,"Ryan Reynolds, Blake Lively, Peter Sarsgaard, Mark Strong, Tim Robbins, Jay O. Sanders, Taika Waititi, Angela Bassett",United States,"September 1, 2021",2011,PG-13,No data,"Action & Adventure, Sci-Fi & Fantasy",Test pilot Hal Jordan harnesses glowing new powers for good when he wears an otherworldly ring and helps an intergalactic force stop a powerful threat.,Christmas Inheritance,Romantic drama,"December 15, 2017",104,5.7,English,True
144,s145,Movie,House Party,Reginald Hudlin,"Christopher Reid, Christopher Martin, Robin Harris, Tisha Campbell, A.J. Johnson, Martin Lawrence, Paul Anthony, Bowlegged Lou, B-Fine, Edith Fields, Kelly Jo Minter, Clifton Powell, Verda Bridges",United States,"September 1, 2021",1990,R,104 min,"Comedies, Cult Movies","Grounded by his strict father, Kid risks life and limb to go to his best friend Play's big bash but experiences one obstacle after another.",Dad Wanted,Family,"September 11, 2020",102,5.7,Spanish,True
145,s146,Movie,House Party 2,"George Jackson, Doug McHenry","Christopher Reid, Christopher Martin, Martin Lawrence, Bowlegged Lou, Paul Anthony, B-Fine, Tisha Campbell, Kamron, Iman, Queen Latifah",United States,"September 1, 2021",1991,R,No data,"Comedies, Cult Movies, Music & Musicals","Kid goes off to college with scholarship money but when Play loses Kid's tuition funds to a shady music promoter, they devise a wild plan to raise cash.",El Camino Christmas,Dark comedy,"December 8, 2017",89,5.7,English,True
146,s147,Movie,House Party 3,Eric Meza,"Christopher Reid, Christopher Martin, Tisha Campbell, David Edwards, Angela Means, Ketty Lester, Bernie Mac, Michael Colyar, Chris Tucker, Khandi Alexander",United States,"September 1, 2021",1994,R,No data,"Comedies, Music & Musicals","After Kid gets engaged, Play plans to throw the biggest bachelor party ever. But every celebration for these two always comes with complications.",Eli,Horror,"October 18, 2019",98,5.7,English,True
147,s148,TV Show,How to Be a Cowboy,Unknown,Unknown,Unknown,"September 1, 2021",2021,TV-PG,No data,Reality TV,"Dale Brisby uses social media savvy and rodeo skills to keep cowboy traditions alive — and now he's teaching the world how to cowboy right, ol' son.",Ginny Weds Sunny,Romantic comedy,"October 9, 2020",125,5.7,Hindi,True
148,s149,TV Show,HQ Barbers,Gerhard Mostert,"Hakeem Kae-Kazim, Chioma Omeruah, Orukotan Adejola, Flora Chiedo, Emeka Nwagbaraocha, Anthony Oseyemi, Oluwabukola Thomas, Soibifaa Dokubo",Unknown,"September 1, 2021",2020,TV-14,No data,TV Shows,"When a family run barber shop in the heart of Lagos is threatened by real estate developers, they'll do whatever it takes to stay in business.",Good Sam,Drama,"May 16, 2019",89,5.7,English,True
149,s150,Movie,I Got the Hook Up,Michael Martin,"Master P, Anthony Johnson, Gretchen Palmer, Frantz Turner, Richard Keats, Joe Estevez, William Knight, Anthony Boswell, Tommy 'Tiny' Lister, Helen Martin, John Witherspoon, Mia X",United States,"September 1, 2021",1998,R,No data,"Action & Adventure, Comedies","After getting their hands on a misdirected shipment of cell phones, two hustlers try to cash in by hawking the merchandise from the back of their van.",Lionheart,Comedy,"January 4, 2019",94,5.7,English,True
150,s151,Movie,In Too Deep,Michael Rymer,"Omar Epps, LL Cool J, Nia Long, Stanley Tucci, Pam Grier, Hill Harper, Jake Weber, David Patrick Kelly, Veronica Webb, Ron Canada, Robert LaSardo, Gano Grills, Ivonne Coll, Don Harvey, Mya, Nasir 'Nas' Jones, Jermaine Dupri",United States,"September 1, 2021",1999,R,No data,Thrillers,"Rookie cop Jeffrey Cole poses as a drug dealer to take down a crime lord and soon gets caught up in an underworld of bribery, intimidation and murder.",Little Evil,Comedy horror,"September 1, 2017",94,5.7,English,True
151,s152,Movie,Initial D,"Andrew Lau Wai-keung, Alan Mak","Jay Chou, Anne Suzuki, Edison Chen, Anthony Wong Chau-sang, Shawn Yue, Chapman To, Jordan Chan, Kenny Bee","China, Hong Kong","September 1, 2021",2005,TV-14,No data,"Action & Adventure, International Movies","By day, an 18-year-old delivers tofu for his father, a retired race car driver; but by night, it's the teen's turn to take the wheel.",One Take,Documentary,"June 18, 2020",85,5.7,Thai,True
152,s153,Movie,Janoskians: Untold and Untrue,Brett Weiner,"Jai Brooks, Luke Brooks, James Yammouni, Daniel Sahyounie, Beau Brooks",United States,"September 1, 2021",2016,TV-MA,No data,Comedies,Follow the story of three Australian brothers and their two friends who became an international sensation by posting pranks and gags on YouTube.,"Out of Many, One",Documentary,"December 12, 2018",34,5.7,English,True
153,s154,TV Show,Kid-E-Cats,Unknown,"Lori Gardner, Kate Bristol, Billy Bob Thompson, Marc Thompson, Erica Schroeder",Russia,"September 1, 2021",2016,TV-Y,2 Seasons,Kids' TV,"Cookie, Pudding and Candy are kitten siblings whose favorite things are sweet treats and letting their curiosity lead them on adventures in learning.",Point Blank,Action,"July 12, 2019",86,5.7,English,True
154,s155,TV Show,Kuroko's Basketball,Unknown,"Kensho Ono, Yuki Ono, Chiwa Saito, Yoshimasa Hosoya, Hirofumi Nojima, Kenji Hamada, Takuya Eguchi, Soichiro Hoshi, Tatsuhisa Suzuki, Go Inoue, Daisuke Ono, Ryohei Kimura, Junichi Suwabe, Kazuya Nakai, Fumiko Orikasa, Kenichi Suzumura, Kisho Taniyama, Hiroshi Kamiya",Japan,"September 1, 2021",2015,TV-MA,No data,"Anime Series, International TV Shows, Teen TV Shows","Five middle school basketball stars went to separate high schools, and now Tetsuya Kuroko and Seirin High are making their play for glory.",Prime Time,Thriller,"April 14, 2021",91,5.7,Polish,True
155,s156,Movie,Labyrinth,Jim Henson,"David Bowie, Jennifer Connelly, Frank Oz, Kevin Clash, Anthony Asbury, Dave Goelz, Brian Henson, Ron Mueck, Karen Prell, Shari Weiser","United Kingdom, United States","September 1, 2021",1986,PG,No data,"Action & Adventure, Children & Family Movies, Cult Movies","In Jim Henson's fantasy, teen Sarah embarks on a life-altering quest to rescue her little brother from the clutches of a treacherous goblin.",The Do-Over,Action comedy,"May 27, 2016",108,5.7,English,True
156,s157,Movie,Letters to Juliet,Gary Winick,"Amanda Seyfried, Christopher Egan, Gael García Bernal, Vanessa Redgrave, Franco Nero, Luisa Ranieri, Marina Massironi, Milena Vukotic, Marcia DeBonis, Luisa De Santis, Lidia Biondi, Giordano Formenti, Chris Egan",United States,"September 1, 2021",2010,PG,No data,"Comedies, Dramas, Romantic Movies","By responding to a letter addressed to Shakespeare's tragic heroine Juliet Capulet, an American woman in Verona, Italy, is led in search of romance.",The Holiday Calendar,Romantic comedy,"November 2, 2018",95,5.7,English,True
157,s158,Movie,Level 16,Danishka Esterhazy,"Katie Douglas, Celina Martin, Peter Outerbridge, Sara Canning, Alexis Whelan, Amalia Williamson, Josette Halpert, Kiana Madeira",Canada,"September 1, 2021",2018,TV-14,No data,"Sci-Fi & Fantasy, Thrillers","In a bleak academy that teaches girls the virtues of passivity, two students uncover the ghastly purpose behind their training and resolve to escape.",The Woman in the Window,Psychological thriller,"May 14, 2021",100,5.7,English,True
158,s159,Movie,Love Don't Cost a Thing,Troy Byer,"Nick Cannon, Christina Milian, Kenan Thompson, Kal Penn, Steve Harvey, Al Thompson, Ashley Monique Clark, Elimu Nelson, Nichole Robinson, Melissa Schuman",United States,"September 1, 2021",2003,PG-13,No data,"Comedies, Romantic Movies",A nerdy teen tries to make himself cool by association when he convinces a popular cheerleader to pose as his girlfriend.,The Wrong Missy,Comedy,"May 13, 2020",90,5.7,English,True
159,s160,Movie,Love in a Puff,Pang Ho-cheung,"Miriam Chin Wah Yeung, Shawn Yue, Singh Hartihan Bitto, Isabel Chan, Cheung Tat-ming, Matt Chow, Chui Tien-you, Queenie Chu, Charmaine Fong, Vincent Kok",Hong Kong,"September 1, 2021",2010,TV-MA,No data,"Comedies, Dramas, International Movies","When the Hong Kong government enacts a ban on smoking cigarettes indoors, the new law drives hard-core smokers outside, facilitating unlikely connections.",Velvet Buzzsaw,Thriller,"February 1, 2019",112,5.7,English,True
161,s162,Movie,Mars Attacks!,Tim Burton,"Jack Nicholson, Glenn Close, Annette Bening, Pierce Brosnan, Danny DeVito, Martin Short, Sarah Jessica Parker, Michael J. Fox, Rod Steiger, Tom Jones, Lukas Haas, Natalie Portman",United States,"September 1, 2021",1996,PG-13,No data,"Comedies, Cult Movies, Sci-Fi & Fantasy","As flying saucers head for Earth, the president of the United States prepares to welcome alien visitors but soon learns they're not coming in peace.",15 August,Comedy-drama,"March 29, 2019",124,5.8,Marathi,True
162,s163,Movie,Marshall,Reginald Hudlin,"Chadwick Boseman, Josh Gad, Kate Hudson, Sterling K. Brown, Dan Stevens, James Cromwell, Keesha Sharp, Roger Guenveur Smith, Derrick Baskin, Barrett Doss","United States, China, Hong Kong","September 1, 2021",2017,PG-13,118 min,Dramas,"This biopic of Thurgood Marshall, the first Black U.S. Supreme Court justice, centers on his pivotal work in a sensational case as an NAACP lawyer.",A California Christmas,Romantic comedy,"December 14, 2020",107,5.8,English,True
163,s164,Movie,My Boss's Daughter,David Zucker,"Ashton Kutcher, Tara Reid, Jeffrey Tambor, Andy Richter, Michael Madsen, Jon Abrahams, David Koechner, Carmen Electra, Kenan Thompson, Terence Stamp, Molly Shannon",United States,"September 1, 2021",2003,R,No data,"Comedies, Romantic Movies","A young man house-sits for his mean boss, hoping to use it as an opportunity to win the heart of the boss's daughter, on whom he's long had a crush.",A Christmas Prince,Romantic comedy,"November 17, 2017",92,5.8,English,True
164,s165,Movie,Mystery Men,Kinka Usher,"Ben Stiller, Hank Azaria, William H. Macy, Janeane Garofalo, Kel Mitchell, Paul Reubens, Wes Studi, Greg Kinnear, Geoffrey Rush, Lena Olin, Eddie Izzard, Artie Lange, Pras, Claire Forlani, Tom Waits",United States,"September 1, 2021",1999,PG-13,121 min,"Action & Adventure, Comedies",A team of far-from-super heroes try to earn respect by springing into action when brave and dashing Captain Amazing disappears.,All Day and a Night,Drama,"May 1, 2020",121,5.8,English,True
165,s166,TV Show,Oldsters,Unknown,"Patricio Contreras, Alejandro Goic, Sergio Hernández, Mariana Loyola Ruz, Alejandro Trejo, Daniel Alcaíno Cuevas, Nicolás Poblete, Susana Hidalgo, Gloria Münchmeyer",Unknown,"September 1, 2021",2019,TV-MA,No data,"Crime TV Shows, International TV Shows, Spanish-Language TV Shows",Three friends in their 70s step out of retirement to become a band of outlaws whose mission is to help those let down by the justice system.,American Son,Drama,"November 1, 2019",90,5.8,English,True
166,s167,Movie,Once Upon a Time in America,Sergio Leone,"Robert De Niro, James Woods, Elizabeth McGovern, Treat Williams, Tuesday Weld, Burt Young, Joe Pesci, Danny Aiello, William Forsythe, James Hayden","Italy, United States","September 1, 2021",1984,R,229 min,"Classic Movies, Dramas",Director Sergio Leone's sprawling crime epic follows a group of Jewish mobsters who rise in the ranks of organized crime in 1920s New York City.,Barry,Biopic,"December 16, 2016",104,5.8,English,True
167,s168,Movie,Open Season 2,"Matthew O'Callaghan, Todd Wilderman","Joel McHale, Mike Epps, Jane Krakowski, Billy Connolly, Crispin Glover, Steve Schirripa, Georgia Engel, Diedrich Bader, Cody Cameron, Fred Stoller, Olivia Hack","United States, Canada","September 1, 2021",2008,PG,76 min,"Children & Family Movies, Comedies",Elliot the buck and his forest-dwelling cohorts must rescue their dachshund pal from some spoiled pets bent on returning him to domesticity.,Candy Jar,Comedy,"April 27, 2018",92,5.8,English,True
168,s169,Movie,Osmosis Jones,"Bobby Farrelly, Peter Farrelly","Chris Rock, Laurence Fishburne, David Hyde Pierce, Brandy Norwood, William Shatner, Ron Howard, Kid Rock, Ben Stein",United States,"September 1, 2021",2001,PG,No data,"Action & Adventure, Children & Family Movies, Comedies",Peter and Bobby Farrelly outdo themselves with this partially animated tale about an out-of-shape 40-year-old man who's the host to various organisms.,Choked: Paisa Bolta Hai,Drama,"June 5, 2020",114,5.8,Hindi,True
