Unnamed: 0,show_id,type,title,director,cast,country,date_added,release_year,rating,duration,listed_in,description,Title,Genre,Premiere,Runtime,IMDB Score,Language,is_original
412,s413,Movie,Chhota Bheem and the Incan Adventure,Rajiv Chilaka,"Vatsal Dubey, Julie Tejwani, Rupa Bhimani, Jigna Bhardwaj, Rajesh Kava, Mousam, Swapnil",Unknown,"July 22, 2021",2013,TV-Y7,No data,Children & Family Movies,"When Dholakpur’s princess is kidnapped, Bheem is off to the land of the Incas to save her, but he’s in for an even bigger challenge upon his arrival.",Tony Parker: The Final Shot,Documentary,"January 6, 2021",98,6.8,French,True
413,s414,Movie,Chhota Bheem and The ShiNobi Secret,Rajiv Chilaka,"Vatsal Dubey, Julie Tejwani, Rupa Bhimani, Jigna Bhardwaj, Rajesh Kava, Mousam, Swapnil",Unknown,"July 22, 2021",2013,TV-Y7,64 min,Children & Family Movies,"After learning of a samurai village under threat by their own emperor, Bheem sets off for Japan to offer his help.",AK vs AK,Thriller,"December 24, 2020",108,6.9,Hindi,True
414,s415,Movie,Chhota Bheem Aur Hanuman,Rajiv Chilaka,"Vatsal Dubey, Julie Tejwani, Rupa Bhimani, Jigna Bhardwaj, Rajesh Kava, Mousam, Swapnil",Unknown,"July 22, 2021",2012,TV-Y7,68 min,Children & Family Movies,"When two evil entities kidnap a princess in a plot to build a new kingdom, Bheem takes them on with the help of the courageous monkey god Hanuman.",Amanda Knox,Documentary,"September 30, 2016",92,6.9,English,True
416,s417,Movie,Chhota Bheem aur Krishna vs Zimbara,Rajiv Chilaka,"Vatsal Dubey, Julie Tejwani, Rupa Bhimani, Jigna Bhardwaj, Rajesh Kava, Mousam, Swapnil",Unknown,"July 22, 2021",2013,TV-Y7,64 min,Children & Family Movies,"A demon of darkness is plotting world domination — but when Bheem and Krishna catch wind of his plans, they’ll stop at nothing to destroy him.",Biggie: I Got a Story to Tell,Documentary,"March 1, 2021",97,6.9,English,True
417,s418,Movie,Chhota Bheem in African Safari,Binayak Das,"Sonal Kaushal, Rupa Bhimani, Julie Tejwani, Sabina Malik, Jigna Bharadwaj, Rajesh Kava",Unknown,"July 22, 2021",2015,TV-Y7,62 min,Children & Family Movies,Bheem’s plans for an exciting African safari are interrupted when he finds that an evil ruler is using magical powers to cause drought through the land.,Cops and Robbers,Animation / Short,"December 28, 2020",7,6.9,English,True
418,s419,Movie,Chhota Bheem Ka Roosi Romanch,"Arpan Sarkar, Shyamal Chaulia","Julie Tejwani, Sabina Malik, Jigna Bharadwaj, Rupa Bhimani, Lalit Agarwal, Rajesh Shukla, Disha, Rajesh Kava, Raju",Unknown,"July 22, 2021",2019,TV-Y,63 min,Children & Family Movies,"A faulty transportation machine lands Chhota Bheem and his friends in Russia, where they must save a princess from an evil, power-hungry magician.",I Don't Feel at Home in This World Anymore,Drama,"February 24, 2017",96,6.9,English,True
419,s420,Movie,Chhota Bheem: Bheem vs Aliens,Rajiv Chilaka,"Vatsal Dubey, Julie Tejwani, Rupa Bhimani, Jigna Bhardwaj, Rajesh Kava, Mousam, Swapnil",Unknown,"July 22, 2021",2010,TV-Y7,69 min,"Children & Family Movies, Sports Movies",Space invaders have kidnapped Dholakpur’s king and princess! The only way Bheem can rescue them? Defeat the aliens in a cricket match.,Laerte-se,Documentary,"May 19, 2017",100,6.9,Portuguese,True
421,s422,Movie,Chhota Bheem: Dus Pe Dus,"Rajiv Chilaka, Owll Mina","Vatsal Dubey, Julie Tejwani, Rupa Bhimani, Jigna Bhardwaj, Rajesh Kava, Mousam, Swapnil",Unknown,"July 22, 2021",2014,TV-Y7,63 min,Children & Family Movies,"After a precious temple stone is stolen under his watch, Bheem trains in a special martial art to prepare for a showdown with the thief.",Our Souls at Night,Romance,"September 29, 2017",103,6.9,English,True
422,s423,Movie,Chhota Bheem: Journey to Petra,Rajiv Chilaka,"Vatsal Dubey, Julie Tejwani, Rupa Bhimani, Jigna Bhardwaj, Rajesh Kava",Unknown,"July 22, 2021",2011,TV-Y7,68 min,Children & Family Movies,"The king has been away to meet an old friend, but when he sends for urgent help, Bheem finds himself on an action-packed rescue mission to Egypt!",Outlaw King,Historical-epic,"November 9, 2018",121,6.9,English,True
423,s424,Movie,Chhota Bheem: Master of Shaolin,Rajiv Chilaka,"Pooja Punabi, Mausam, Julie Tejwani, Rupa Bhimani, Jigna Bhardwaj, Rajesh Kava, Parigna Pandya",Unknown,"July 22, 2021",2011,TV-Y7,74 min,Children & Family Movies,"Summoned by a monk to help reclaim a temple from a dangerous leader, Bheem must master the Shaolin kung fu techniques if he wants a fighting chance!",Pagglait,Comedy-drama,"March 26, 2021",114,6.9,Hindi,True
425,s426,TV Show,Chicago Med,Unknown,"Colin Donnell, Torrey DeVitto, Oliver Platt, S. Epatha Merkerson, Nick Gehlfuss, Yaya DaCosta, Laurie Holden",United States,"July 22, 2021",2019,TV-14,No data,TV Dramas,"The doctors and nurses of Gaffney Chicago Medical Center juggle the busy ER's dramas and dangers in this spinoff of ""Chicago Fire"" and ""Chicago P.D.""",Seeing Allred,Documentary,"February 9, 2018",95,6.9,English,True
426,s427,Movie,Cousins,"Ainsley Gardiner, Briar Grace-Smith","Rachel House, Briar Grace-Smith, Tanea Heke, Tioreore Ngatai-Melbourne, Ana Scotney, Hariata Moriarty, Chelsie Preston Crayford, Sylvia Rands",New Zealand,"July 22, 2021",2021,TV-MA,No data,Dramas,"Separated as children, three cousins with an unshakeable bond confront their painful pasts and embark on an emotional journey to find each other.",Spelling the Dream,Documentary,"June 3, 2020",83,6.9,English,True
427,s428,Movie,Wannabe Courageous,Mahmoud Karim,"Ramez Galal, Jamila Awad, Bayoumi Fouad, Mohamed Abdel-Rahman, Mohammed Tharwat, Maha Abou Ouf, Noor Kadri, Elshahat Mabrouk, Badriyyah Tulbah, Taher Abu Lela, Sara Derzawy",Unknown,"July 22, 2021",2019,TV-14,90 min,"Comedies, International Movies","When his newlywed wife becomes disenchanted because he failed to protect her from danger, Omar seeks the help of a quirky psychiatrist to win her back.",The Claudia Kishi Club,Documentary,"July 10, 2020",17,6.9,English,True
429,s430,Movie,Sanitation Day,Seyi Babatope,"Blossom Chukwujekwu, Elozonam Ogbolu, Nse Ikpe-Etim, Belinda Effah, Saeed Mohammed, Chukwuemeka Okoroafor, Kunle Fawole, Chris Okagbue, Adebayo Salami, Charles Inojie, Elvina Ibru, Tobi Bakare",Nigeria,"July 21, 2021",2020,TV-14,No data,"Dramas, International Movies, Thrillers",Two cops must contend with the uncooperative tenants of an apartment complex as they try to solve a murder before the crime scene is wiped clean.,The Highwaymen,Crime drama,"March 29, 2019",131,6.9,English,True
430,s431,TV Show,Sexy Beasts,Unknown,Unknown,Unknown,"July 21, 2021",2021,TV-14,No data,"British TV Shows, International TV Shows, Reality TV","Hoping to say goodbye to superficial dating, real-life singles sport elaborate makeup and prosthetics to put true blind-date chemistry to the test.",The Lonely Island Presents: The Unauthorized Bash Brothers Experience,Comedy / Musical,"May 23, 2019",30,6.9,English,True
431,s432,TV Show,Too Hot to Handle: Brazil,Unknown,Bruna Louise,Unknown,"July 21, 2021",2021,TV-MA,No data,"International TV Shows, Reality TV, Romantic TV Shows","Sizzling hot young Brazilians meet at a dreamy beach resort. But for a shot at R$500,000 in this fun reality show, they'll have to give up sex.",The Meyerowitz Stories (New and Selected),Comedy-drama,"October 13, 2017",112,6.9,English,True
432,s433,Movie,Trollhunters: Rise of the Titans,"Johane Matte, Andrew L. Schmidt, Francisco Ruiz Velasco","Emile Hirsch, Lexi Medrano, Charlie Saxton, Kelsey Grammer, Fred Tatasciore, Steven Yeun, Cole Sand, Amy Landecker, Jonathan Hyde, Thomas F. Wilson, Lauren Tom, Diego Luna, Tatiana Maslany, Nick Offerman, Nick Frost, Colin O'Donoghue, Alfred Molina, Piotr Michael, Kay Bess, Angel Lin, James Hong",Unknown,"July 21, 2021",2021,TV-Y7,No data,Children & Family Movies,"Heroes from ""Trollhunters,"" ""3Below"" and ""Wizards"" join forces to fight a shadowy enemy threatening to take over their worlds — and reset Earth itself.",Feminists: What Were They Thinking?,Documentary,"October 12, 2018",86,7.0,English,True
433,s434,Movie,Milkwater,Morgan Ingari,"Molly Bernard, Patrick Breen, Robin de Jesús, Ava Eisenson, Ade Otukoya",United States,"July 20, 2021",2020,TV-MA,No data,"Comedies, Dramas, Independent Movies",Aimless 20-something Milo impulsively becomes a gay man’s surrogate and wrestles with the emotional complexities of her non-traditional decision.,Gaga: Five Foot Two,Documentary,"September 22, 2017",100,7.0,English,True
435,s436,TV Show,Touch Your Heart,Unknown,"Lee Dong-wook, Yoo In-na, Lee Sang-woo, Son Sung-yoon, Oh Jung-se, Shim Hyoung-tak, Jang So-yeon, Park Ji-hwan, Lee Jun-hyuk",Unknown,"July 20, 2021",2019,TV-MA,No data,"Crime TV Shows, International TV Shows, Romantic TV Shows","Hoping to make a comeback after a bad scandal, an actress agrees to research a new role by taking a job as a secretary for a prickly attorney.",Kingdom of Us,Documentary,"October 13, 2017",109,7.0,English,True
436,s437,Movie,The Tambour of Retribution,Abdulaziz Alshlahei,"Faisal Al Dokhei, Adwa Fahad, Muhand Alsaleh, Rawya Ahmed, Ajeba Aldosary, Aly Ibrahim, Samer Elkhal, Hashem Hawsawi, Ibrahim Mesisebi, Shabib Alkhaleefa, Abdulateif Saud, Nada Alshehry, Dhay Nasser",Saudi Arabia,"July 19, 2021",2021,TV-14,No data,"Dramas, International Movies, Romantic Movies","In an impoverished neighborhood, the son of a swordsman falls in love with the daughter of a wedding singer — a taboo match in a traditional society.","Lorena, Light-Footed Woman",Documentary,"November 20, 2019",28,7.0,Spanish,True
437,s438,Movie,Cosmic Sin,Edward Drake,"Frank Grillo, Bruce Willis, Brandon Thomas Lee, Corey Large, Perrey Reeves, C.J. Perry, Lochlyn Munro, Costas Mandylor, Adelaide Kane, Eva De Dominici, Sarah May Sommers, Trevor Gretzky",United States,"July 17, 2021",2021,R,No data,Action & Adventure,"In the year 2524, a disgraced retired general is called back into combat to help prevent an interstellar war against a hostile alien fleet.",Los Tigres del Norte at Folsom Prison,Documentary,"September 15, 2019",64,7.0,Spanish,True
438,s439,Movie,2 Weeks in Lagos,Kathryn Fasegha,"Beverly Naya, Mawuli Gavor, Ajoke Silva, Jide Kosoko, Toyin Abraham, Okey Uzoeshi, Deyemi Okanlawon, Shaffy Bello, Tina Mba, Efe Irele",Unknown,"July 16, 2021",2020,TV-PG,107 min,"Dramas, International Movies, Romantic Movies",A businessman returns home to Nigeria and falls in love with a friend's sister despite his family’s plan for him to marry a politician’s daughter.,Ma Rainey's Black Bottom,Drama,"December 18, 2020",94,7.0,English,True
439,s440,Movie,Deep,"Sita Likitvanichkul, Jetarin Ratanaserikiat, Apirak Samudkitpaisan, Thanabodee Uawithya, Adirek Wattaleela","Panisara Rikulsurakan, Kay Lertsittichai, Supanaree Sutavijitvong, Krit Jeerapattananuwong, Warisara Jitpreedasakul, Dujdao Vadhanapakorn, Kim Waddoup, Philaiwan Khamphirathat, Wongsakorn Rassamitat, Bhumibhat Thavornsiri",Thailand,"July 16, 2021",2021,TV-MA,No data,"Dramas, International Movies, Thrillers",Four insomniac med school students are lured into a neuroscience experiment that spirals out of control — and must find a way out before it’s too late.,Ma Rainey's Black Bottom: A Legacy Brought to Screen,Aftershow / Interview,"December 18, 2020",31,7.0,English,True
442,s443,TV Show,Johnny Test,Unknown,"James Arnold Taylor, Trevor Devall, Maryke Hendrikse, Emily Tennant","United States, Canada","July 16, 2021",2021,TV-Y7,No data,"Kids' TV, TV Comedies","How much trouble could one imaginative boy, his faithful dog and two science-loving sisters possibly get into? Hmm, that sounds like a challenge!",ReMastered: Devil at the Crossroads,Documentary,"April 26, 2019",48,7.0,English,True
443,s444,Movie,La ley de Herodes,Luis Estrada,"Damián Alcázar, Pedro Armendáriz Jr., Delia Casanova, Juan Carlos Colombo, Alex Cox, Guillermo Gil, Ernesto Gómez Cruz, Leticia Huijara, Luis de Icaza, Eduardo López Rojas, Manuel Ojeda, Salvador Sánchez, Evangelina Sosa, Isela Vega",Unknown,"July 16, 2021",1999,R,123 min,"Comedies, International Movies","Following the brutal 1949 murder of a small Mexican town's mayor, genteel and humble janitor Juan Vargas is appointed his successor.",ReMastered: The Lion's Share,Documentary,"May 17, 2019",84,7.0,English,True
444,s445,TV Show,Naomi Osaka,Garrett Bradley,Unknown,Unknown,"July 16, 2021",2021,TV-14,No data,Docuseries,This intimate series follows Naomi Osaka as she explores her cultural roots and navigates her multifaceted identity as a tennis champ and rising leader.,ReMastered: The Miami Showband Massacre,Documentary,"March 22, 2019",70,7.0,English,True
445,s446,Movie,The Beguiled,Sofia Coppola,"Colin Farrell, Nicole Kidman, Kirsten Dunst, Elle Fanning, Oona Laurence, Angourie Rice, Addison Riecke, Emma Howard",United States,"July 16, 2021",2017,R,No data,"Dramas, Independent Movies, Thrillers","During the Civil War, a wounded Union soldier takes refuge at a Southern girls school, rupturing the calm amid growing sexual tension and infighting.",Resurface,Documentary,"September 1, 2017",27,7.0,English,True
446,s447,Movie,The Book of Henry,Colin Trevorrow,"Naomi Watts, Jaeden Martell, Jacob Tremblay, Sarah Silverman, Dean Norris, Lee Pace, Maddie Ziegler, Tonya Pinkins, Bobby Moynihan, Geraldine Hughes",United States,"July 16, 2021",2017,PG-13,No data,Dramas,"An 11-year-old vows to help a new neighbor who he suspects is in danger, and documents his efforts in a series of written entries and audio recordings.",Rocko's Modern Life: Static Cling,Animation / Comedy,"August 9, 2019",45,7.0,English,True
447,s448,Movie,The Twilight Saga: Breaking Dawn: Part 1,Bill Condon,"Kristen Stewart, Robert Pattinson, Taylor Lautner, Billy Burke, Peter Facinelli, Elizabeth Reaser, Kellan Lutz, Nikki Reed, Jackson Rathbone, Ashley Greene",United States,"July 16, 2021",2011,PG-13,117 min,"Dramas, Romantic Movies","After a dream wedding, Bella and Edward enter a new nightmare when a shocking development forces life-or-death decisions.",Rose Island,Comedy,"December 9, 2020",117,7.0,Italian,True
448,s449,Movie,The Twilight Saga: Breaking Dawn: Part 2,Bill Condon,"Kristen Stewart, Robert Pattinson, Taylor Lautner, Peter Facinelli, Elizabeth Reaser, Ashley Greene, Jackson Rathbone, Kellan Lutz, Nikki Reed, Billy Burke",United States,"July 16, 2021",2012,PG-13,No data,"Dramas, Romantic Movies","In the epic series' final chapter, Bella and Edward's newborn daughter forces the couple into a life-altering confrontation with the Volturi.",The Christmas Chronicles,Christmas/Fantasy/Adventure/Comedy,"November 22, 2018",104,7.0,English,True
449,s450,Movie,The Twilight Saga: Eclipse,David Slade,"Kristen Stewart, Robert Pattinson, Taylor Lautner, Bryce Dallas Howard, Billy Burke, Dakota Fanning, Peter Facinelli, Elizabeth Reaser, Jackson Rathbone, Kellan Lutz, Ashley Greene, Nikki Reed",United States,"July 16, 2021",2010,PG-13,124 min,"Dramas, Romantic Movies","With a bloodthirsty enemy on a quest for revenge, Bella must reconcile her love for vampire Edward and her growing feelings for werewolf Jacob.",The Dirt,Biopic,"March 22, 2019",108,7.0,English,True
450,s451,Movie,The Twilight Saga: New Moon,Chris Weitz,"Kristen Stewart, Robert Pattinson, Taylor Lautner, Ashley Greene, Rachelle Lefevre, Billy Burke, Michael Sheen, Dakota Fanning, Peter Facinelli, Elizabeth Reaser, Jackson Rathbone, Kellan Lutz, Nikki Reed, Edi Gathegi",United States,"July 16, 2021",2009,PG-13,131 min,"Dramas, Romantic Movies","Still reeling from the departure of vampire Edward Cullen, a heartbroken Bella Swan finds comfort in her friendship with werewolf Jacob Black.",The Night Comes for Us,Action-thriller,"October 19, 2018",121,7.0,Indonesian,True
452,s453,Movie,A Perfect Fit,Hadrah Daeng Ratu,"Nadya Arina, Refal Hady, Giorgino Abraham, Anggika Bolsterli, Laura Theux, Christine Hakim, Unique Priscilla, Karina Suwandi, Mathias Muchus, Ayu Laksmi, I Made Sidia, Dominique Sanda, Bryan Domani, Wafda Saifan, Yayu Unru, Dave Hendrik",Indonesia,"July 15, 2021",2021,TV-PG,113 min,"Comedies, Dramas, International Movies","Sparks fly when a fashion blogger in Bali meets a gifted shoemaker, leading her to question her commitment to her fiancé.",Angela's Christmas,Animation,"November 30, 2018",30,7.1,English,True
453,s454,TV Show,BEASTARS,Unknown,"Chikahiro Kobayashi, Sayaka Senbongi, Yuki Ono, Atsumi Tanezaki, Junya Enoki, Yuma Uchida, Takeo Otsuka, Naoto Kobayashi, Yoshiyuki Shimozuma, Nobuhiko Okamoto, Fukushi Ochiai, Takaaki Torashima, Sayumi Watabe, Genki Muro, Yuichi Iguchi, Yuko Hara, Ikuto Kanemasa, Ouchi Akane, Hibiku Yamamura, Sakura Ando, Akio Otsuka, Mitsuaki Hoshino, Kenyu Horiuchi",Japan,"July 15, 2021",2021,TV-MA,2 Seasons,"Anime Series, International TV Shows","In a world where beasts of all kinds coexist, a gentle wolf awakens to his own predatory urges as his school deals with a murder within its midst.",Angela's Christmas Wish,Animation,"December 1, 2020",47,7.1,English,True
454,s455,Movie,Cheech & Chong's Still Smokin,Tommy Chong,"Cheech Marin, Tommy Chong, Susan Hahn, Carol van Herwijnen, Shireen Strooker",Unknown,"July 15, 2021",1983,TV-MA,No data,"Comedies, Cult Movies","Stoner comedians Cheech Marin and Tommy Chong arrive in Amsterdam to find they've been mistakenly invited, then take the stage live as a replacement act.",Beats,Drama,"June 19, 2019",110,7.1,English,True
455,s456,Movie,Emicida: AmarElo - Live in São Paulo,Fred Ouro Preto,Emicida,Unknown,"July 15, 2021",2021,TV-MA,No data,"Documentaries, International Movies, Music & Musicals","Brazilian rapper Emicida brings his progressive rhymes and eclectic beats to São Paulo's Theatro Municipal as he performs hits from the album ""AmarElo.""",Circus of Books,Documentary,"April 22, 2020",92,7.1,English,True
456,s457,TV Show,Her Private Life,Unknown,"Park Min-young, Kim Jae-uk, Ahn Bo-hyun, Jung Je-won, Park Jin-joo, Kim Bo-ra, Maeng Sang-hun, Kim Mee-kyung, Kim Sun-young, Lee Il-hwa",South Korea,"July 15, 2021",2019,TV-14,No data,"International TV Shows, Romantic TV Shows, TV Comedies","An art curator's life unravels, as she tries to keep her pastime as a die-hard K-pop fan secret from her gallery's new director.",Dance Dreams: Hot Chocolate Nutcracker,Documentary,"November 27, 2020",80,7.1,English,True
457,s458,Movie,Lift Like a Girl,Mayye Zayed,Unknown,"Egypt, Denmark, Germany","July 15, 2021",2021,TV-PG,No data,"Documentaries, International Movies, Sports Movies","With the guidance of her relentless coach, a teen weightlifter emerges from a scrappy training camp in Egypt to compete at the championship level.",Derren Brown: Sacrifice,Mentalism special,"October 19, 2018",49,7.1,English,True
459,s460,TV Show,Never Have I Ever,Unknown,"Maitreyi Ramakrishnan, Poorna Jagannathan, Richa Moorjani, Jaren Lewison, Darren Barnet, John McEnroe, Ramona Young, Lee Rodriguez, Sendhil Ramamurthy, Adam Shapiro, Niecy Nash, Cocoa Brown, Lily D. Moore, Eddie Liu",United States,"July 15, 2021",2021,TV-14,2 Seasons,"TV Comedies, TV Dramas, Teen TV Shows","After a traumatic year, all an Indian-American teen wants is to go from pariah to popular — but friends, family and feelings won’t make it easy on her.",End Game,Documentary,"May 4, 2018",40,7.1,English,True
460,s461,Movie,Surf's Up,"Ash Brannon, Chris Buck","Shia LaBeouf, Jeff Bridges, Zooey Deschanel, Jon Heder, James Woods, Diedrich Bader, Mario Cantone, Kelly Slater, Rob Machado, Sal Masekela","United States, Canada","July 15, 2021",2007,PG,No data,"Children & Family Movies, Comedies, Sports Movies",This Oscar-nominated animated comedy goes behind the scenes at the Penguin World Surfing Championship to get a close-up look at the inventors of surfing.,Evelyn,Documentary,"September 10, 2019",96,7.1,English,True
461,s462,Movie,The Unknown Saint,Alaa Eddine Aljem,"Younes Bouab, Salah Bensalah, Bouchaib Essamak, Mohamed Naimane, Anas Elbaz, Hassan Ben Badida, Abdelghani Kitab, Ahmed Yarziz, Rachid El Adouani, Mohamed El Moutamassik, Abdel Ghani Benizza, Adam Morjany",Unknown,"July 15, 2021",2019,TV-14,No data,"Comedies, Dramas, Independent Movies","Following a stint behind bars, a thief returns to where he buried his loot, only to find that his hiding spot is now a shrine to an unknown saint.",Ferry,Crime drama,"May 14, 2021",106,7.1,Dutch,True
462,s463,Movie,This Changes Everything,Tom Donahue,Unknown,United States,"July 15, 2021",2019,TV-MA,No data,Documentaries,This documentary takes a deep look at gender disparity in Hollywood through the eyes of well-known actresses and female filmmakers.,Grass Is Greener,Documentary,"April 20, 2019",97,7.1,English,True
463,s464,Movie,A Classic Horror Story,"Roberto De Feo, Paolo Strippoli","Matilda Lutz, Francesco Russo, Peppino Mazzotta, Will Merrick, Yuliia Sobol, Alida Baldari Calabria, Cristina Donadio, Francesca Cavallin",Italy,"July 14, 2021",2021,TV-MA,No data,"Horror Movies, International Movies","In this gruesome suspense film, strangers traveling in southern Italy become stranded in the woods, where they must fight desperately to get out alive.",Guillermo Vilas: Settling the Score,Documentary,"October 27, 2020",94,7.1,Spanish,True
464,s465,Movie,Gunpowder Milkshake,Navot Papushado,"Karen Gillan, Lena Headey, Carla Gugino, Chloe Coleman, Michelle Yeoh, Angela Bassett, Paul Giamatti, Ralph Ineson, Adam Nagaitis, Michael Smiley, Freya Allan",Unknown,"July 14, 2021",2021,R,No data,"Action & Adventure, Comedies","When an assassin veers off mission to rescue a child, she triggers a war with a powerful crime syndicate — and reunites a gun-wielding sisterhood.",Joshua: Teenager vs. Superpower,Documentary,"May 26, 2017",78,7.1,English,True
465,s466,TV Show,Heist,Unknown,Unknown,Unknown,"July 14, 2021",2021,TV-MA,No data,"Crime TV Shows, Docuseries",Millions in stolen cash. Missing luxury bourbon. Watch ordinary people almost get away with these extraordinary heists in this true crime series.,Keith Richards: Under the Influence,Documentary,"September 18, 2015",81,7.1,English,True
467,s468,Movie,Private Network: Who Killed Manuel Buendía?,Manuel Alcalá,Daniel Giménez Cacho,Unknown,"July 14, 2021",2021,TV-MA,No data,"Documentaries, International Movies",A deep dive into the work of renowned Mexican journalist Manuel Buendía looks to unravel his murder and the ties between politics and drug trafficking.,Loudon Wainwright III: Surviving Twin,One-man show,"November 13, 2018",91,7.1,English,True
468,s469,Movie,The Guide to the Perfect Family,Ricardo Trogi,"Louis Morissette, Émilie Bierre, Catherine Chabot, Xavier Lebel, Isabelle Guérard, Gilles Renaud, Alexandre Goyette, Jean-Carl Boucher, Louise Portal",Unknown,"July 14, 2021",2021,TV-MA,No data,"Comedies, Dramas, International Movies","A couple in Québec deals with the pitfalls, pressure and high expectations of raising kids in a society obsessed with success and social media image.",My Beautiful Broken Brain,Documentary,"March 18, 2016",91,7.1,English,True
469,s470,Movie,American Woman,Semi Chellas,"Hong Chau, Sarah Gadon, John Gallagher Jr., Lola Kirke, Ellen Burstyn, David Cubitt, Jordan Pettle, Richard Walters","United States, Canada","July 13, 2021",2019,TV-MA,No data,"Dramas, Independent Movies","In rural Pennsylvania, a working-class single mom must pick up the pieces and step up to raise her grandson after her daughter suddenly disappears.",One of Us,Documentary,"October 20, 2017",95,7.1,English,True
470,s471,Movie,Bridgerton - The Afterparty,Unknown,"David Spade, London Hughes, Fortune Feimster",Unknown,"July 13, 2021",2021,TV-14,39 min,Movies,"""Bridgerton"" cast members share behind-the-scenes stories from the hit show, plus comedian Nikki Glaser breaks down the costume drama's sexiest moments.",Pieces of a Woman,Drama,"January 7, 2021",126,7.1,English,True
471,s472,Movie,Day of Destiny,"Akay Mason, Abosi Ogba","Olumide Oworu, Denola Grey, Gbemi Akinlade, Jide Kosoko, Ireti Doyle, Norbert Young, Toyin Abraham, Blossom Chukwujekwu, Broda Shaggi, Ini Dima-Okojie, Deyemi Okanlawon",Unknown,"July 13, 2021",2021,TV-PG,110 min,"Children & Family Movies, Dramas, International Movies","With their family facing financial woes, two teen brothers seize an opportunity to reverse their bad fortunes by traveling 20 years back in time.","Ram Dass, Going Home",Documentary,"April 6, 2018",31,7.1,English,True
473,s474,Movie,Born to Play,Viridiana Lieberman,Unknown,United States,"July 12, 2021",2020,TV-MA,No data,"Documentaries, Sports Movies","This documentary follows the Boston Renegades — an all-woman, tackle football team — as they risk their time, families and day jobs for the game.",Rooting for Roona,Documentary,"October 15, 2020",41,7.1,Bengali,True
475,s476,Movie,The Stand-Up,Daniel Růžička,"Iva Pazderková, Lukáš Pavlásek, Daniel Čech, Petr Cerha, Ondřej Havlík, Radek Petráš, Zbyněk Vičar, Pavel Tomeš, Nela Berg",Unknown,"July 10, 2021",2019,TV-MA,No data,Stand-Up Comedy,Members of the comedy group Na Stojáka take the stage and the mic by storm for a special night of stand-up comedy.,The Dig,Drama,"January 29, 2021",112,7.1,English,True
476,s477,Movie,The Tour,Juraj Šajmovič,"Miloš Knor, Lukáš Pavlásek, Tomáš Matonoha, Ester Kočičková, Michal Kavalčík, Richard Nedvěd",Unknown,"July 10, 2021",2016,TV-MA,No data,"Comedies, Documentaries, International Movies","Miloš Knor brings comedians Lukáš Pavlásek, Tomáš Matonoha, Ester Kočičková, Michal Kavalčík and Richard Nedvěd on a tour around the Czech Republic.",The Great Hack,Documentary,"July 24, 2019",114,7.1,English,True
