Unnamed: 0,show_id,type,title,director,cast,country,date_added,release_year,rating,duration,listed_in,description,Title,Genre,Premiere,Runtime,IMDB Score,Language,is_original
231,s232,Movie,The Water Man,David Oyelowo,"David Oyelowo, Rosario Dawson, Lonnie Chavis, Amiah Miller, Alfred Molina, Maria Bello",United States,"August 25, 2021",2021,PG,No data,"Children & Family Movies, Dramas","Desperate to save his ailing mother, 11-year-old Gunner runs away from home on a quest to find a mythic figure rumored to have the power to cheat death.",Otherhood,Comedy,"August 2, 2019",100,6.1,English,True
232,s233,TV Show,Wheel of Fortune,Unknown,"Pat Sajak, Vanna White",United States,"August 25, 2021",2019,TV-G,No data,Reality TV,"Pat Sajak and Vanna White host one of TV's most popular, long-running game shows, where players spin a wheel for prizes and solve mystery phrases.",Pee-wee's Big Holiday,Adventure,"March 18, 2016",89,6.1,English,True
233,s234,Movie,Count Me In,Mark Lo,Unknown,United Kingdom,"August 24, 2021",2021,TV-MA,82 min,"Documentaries, Music & Musicals",This documentary features some of rock's greatest drummers as they come together in an inspiring rhythmic journey about the power of human connection.,Rogue City,Crime drama,"October 30, 2020",116,6.1,French,True
234,s235,TV Show,Oggy Oggy,Unknown,Unknown,Unknown,"August 24, 2021",2021,TV-Y,No data,"Kids' TV, TV Comedies",Join adorable kitten Oggy and his cast of cat pals in a bright and colorful kitty world. They're always on the go for fun times and fantastic adventures!,Sergio,Biopic,"April 17, 2020",118,6.1,English,True
235,s236,Movie,Untold: Caitlyn Jenner,Crystal Moselle,Unknown,Unknown,"August 24, 2021",2021,TV-PG,70 min,"Documentaries, LGBTQ Movies, Sports Movies",Caitlyn Jenner's unlikely path to Olympic glory was inspirational. But her more challenging road to embracing her true self proved even more meaningful.,Stuck Apart,Drama,"January 8, 2021",96,6.1,Turkish,True
236,s237,Movie,Boomika,Rathindran R Prasad,"Aishwarya Rajesh, Vidhu, Surya Ganapathy, Madhuri, Pavel Navageethan, Avantika Vandanapu",Unknown,"August 23, 2021",2021,TV-14,122 min,"Horror Movies, International Movies, Thrillers","Paranormal activity at a lush, abandoned property alarms a group eager to redevelop the site, but the eerie events may not be as unearthly as they think.",Tersanjung the Movie,Drama,"April 1, 2021",114,6.1,Indonesian,True
237,s238,Movie,Boomika (Hindi),Rathindran R Prasad,"Aishwarya Rajesh, Vidhu, Surya Ganapathy, Madhuri, Pavel Navageethan, Avantika Vandanapu",Unknown,"August 23, 2021",2021,TV-14,122 min,"Horror Movies, International Movies, Thrillers","Paranormal activity at a lush, abandoned property alarms a group eager to redevelop the site, but the eerie events may not be as unearthly as they think.",The Killer,Western,"November 10, 2017",99,6.1,Portuguese,True
238,s239,Movie,Boomika (Malayalam),Rathindran R Prasad,"Aishwarya Rajesh, Vidhu, Surya Ganapathy, Madhuri, Pavel Navageethan, Avantika Vandanapu",Unknown,"August 23, 2021",2021,TV-14,122 min,"Horror Movies, International Movies, Thrillers","Paranormal activity at a lush, abandoned property alarms a group eager to redevelop the site, but the eerie events may not be as unearthly as they think.",The Lovebirds,Romantic comedy,"May 22, 2020",87,6.1,English,True
239,s240,Movie,Boomika (Telugu),Rathindran R Prasad,"Aishwarya Rajesh, Vidhu, Surya Ganapathy, Madhuri, Pavel Navageethan, Avantika Vandanapu",Unknown,"August 23, 2021",2021,TV-14,122 min,"Horror Movies, International Movies, Thrillers","Paranormal activity at a lush, abandoned property alarms a group eager to redevelop the site, but the eerie events may not be as unearthly as they think.",The Most Hated Woman in America,Biopic,"March 24, 2017",92,6.1,English,True
240,s241,Movie,The Witcher: Nightmare of the Wolf,Han Kwang Il,"Theo James, Mary McDonnell, Lara Pulver, Graham McTavish, Tom Canton, David Errigo Jr, Jennifer Hale, Kari Wahlgren, Matt Yang King, Darryl Kurylo, Keith Ferguson",Unknown,"August 23, 2021",2021,TV-MA,84 min,"Action & Adventure, Anime Features","Escaping from poverty to become a witcher, Vesemir slays monsters for coin and glory, but when a new menace rises, he must face the demons of his past.",The Perfection,Horror-thriller,"May 24, 2019",90,6.1,English,True
242,s243,TV Show,Comedy Premium League,Unknown,Unknown,Unknown,"August 20, 2021",2021,TV-MA,No data,"International TV Shows, TV Comedies","With satirical sketches, cheeky debates and blistering roasts, 16 of India’s wittiest entertainers compete in teams to be named the ultimate comedy champs.",Unknown Origins,Thriller,"August 28, 2020",96,6.1,Spanish,True
243,s244,TV Show,Everything Will Be Fine,Unknown,"Lucía Uribe, Flavio Medina, Isabella Vazquez Morales, Pierre Louis, Mercedes Hernández",Unknown,"August 20, 2021",2021,TV-MA,No data,"International TV Shows, Spanish-Language TV Shows, TV Comedies",A separated couple live together for their child's sake in this satirical dramedy about what it means to be a good parent and spouse in today's world.,Work It,Dance comedy,"August 7, 2020",93,6.1,English,True
244,s245,Movie,Gunshot,Karim El Shenawy,"Ahmed El Fishawy, Ruby, Mohamed Mamdouh, Ahmed Malek, Asmaa Abulyazeid, Samy Maghawry, Safaa El-Toukhy, Ahmed Kamal, Arfa Abdel Rassoul, Hana Shiha",Unknown,"August 20, 2021",2018,TV-14,No data,"Dramas, International Movies, Thrillers","After a clash at a protest ends in bloodshed, a forensic doctor and a journalist embark on a search for the elusive truth.",Alien Xmas,Stop Motion,"November 20, 2020",42,6.2,English,True
245,s246,TV Show,Korean Cold Noodle Rhapsody,Unknown,Paik Jong-won,Unknown,"August 20, 2021",2021,TV-PG,No data,"Docuseries, International TV Shows","Refreshing and flavorful, naengmyeon is Korea's coolest summertime staple. A journey through its history begins, from how it's cooked to how it's loved.",Baggio: The Divine Ponytail,Biopic,"May 26, 2021",92,6.2,Italian,True
246,s247,Movie,Man in Love,Yin Chen-hao,"Roy Chiu, Ann Hsu, Tsai Chen-nan, Chung Hsin-ling, Lan Wei-hua, Peace Yang, Huang Lu Tz-yin",Unknown,"August 20, 2021",2021,TV-MA,No data,"Dramas, International Movies, Romantic Movies","When he meets a debt-ridden woman who's caring for her ailing father, a debt collector with a heart of gold sets out to win her love.",Below Zero,Drama,"January 29, 2021",106,6.2,Spanish,True
247,s248,Movie,Sweet Girl,Brian Andrew Mendoza,"Jason Momoa, Isabela Merced, Manuel Garcia-Rulfo, Amy Brenneman, Adria Arjona, Raza Jaffrey, Justin Bartha, Lex Scott Davis, Michael Raymond-James",United States,"August 20, 2021",2021,R,110 min,"Action & Adventure, Dramas","He lost the love of his life to a pharmaceutical company's greed. Now his daughter is without a mother, and he's without justice. For now.",Citation,Drama,"November 6, 2020",151,6.2,English,True
248,s249,TV Show,The Chair,Unknown,"Sandra Oh, Jay Duplass, Holland Taylor, David Morse, Bob Balaban, Nana Mensah, Everly Carganilla",Unknown,"August 20, 2021",2021,TV-MA,No data,"TV Comedies, TV Dramas","At a major university, the first woman of color to become chair tries to meet the dizzying demands and high expectations of a failing English department.",Crazy Awesome Teachers,Comedy-drama,"August 17, 2020",101,6.2,Indonesian,True
250,s251,Movie,A Faraway Land,Veronica Velasco,"Paolo Contis, Yen Santos, Hans Tórgarð, Ruby Ruiz, Zweden Obias, Maria Rianne Castro, Arianne Mavis Uera, Maricor Canlas",Unknown,"August 19, 2021",2020,TV-PG,No data,"Dramas, International Movies, Romantic Movies","In the Faroe Islands, a married woman meets a reporter filming a documentary on overseas Filipino workers, which soon sparks a complicated love story.",High Flying Bird,Sports-drama,"February 8, 2019",90,6.2,English,True
251,s252,Movie,Like Crazy,Drake Doremus,"Anton Yelchin, Felicity Jones, Jennifer Lawrence, Charlie Bewley, Alex Kingston, Oliver Muirhead, Finola Hughes, Chris Messina, Ben York Jones, Jamie Thomas King",United States,"August 19, 2021",2011,PG-13,No data,"Dramas, Independent Movies, Romantic Movies",A spirited exchange student and an American man fall in love in LA. But their romance faces an uphill battle when she is forced to return to England.,In the Shadow of the Moon,Thriller,"September 27, 2019",115,6.2,English,True
252,s253,Movie,Black Island,Miguel Alexandre,"Philip Froissant, Alice Dwyer, Hanns Zischler, Mercedes Müller, Sammy Scheuritzel, Lieselotte Voß, Katharina Schütz, Jodie Leslie Ahlborn, Marco Wittorf, Ilknur Boyraz",Unknown,"August 18, 2021",2021,TV-MA,No data,"International Movies, Thrillers",The dark secrets of a seemingly peaceful island threaten to swallow up an orphaned student when he grows close to a mysterious new teacher.,Lost Bullet,Thriller,"June 19, 2020",92,6.2,French,True
253,s254,Movie,Bombay,Mani Ratnam,"Arvind Swamy, Manisha Koirala, Nasser, Raja Krishnamoorthy",India,"August 18, 2021",1995,TV-14,135 min,"Dramas, International Movies, Romantic Movies","Years after they elope against their family’s wishes, a couple and their sons become caught in the throes of conflict in their city.",Octonauts & the Caves of Sac Actun,Animation,"August 14, 2020",72,6.2,English,True
254,s255,TV Show,Go! Go! Cory Carson,Unknown,"Alan C. Lim, Paul Killam, Maisie Benson, Kerry Gudjohnsen, Smith Foreman, Neena-Sinaii Simpo, Eli Morse, Adelaide Hirasaki, Jim Capobianco, Anna Chambers, Pfifer Chastain",United States,"August 18, 2021",2021,TV-Y,No data,Kids' TV,"Beep, beep – go, go! Buckle up for fun and adventure with adorable kid car Cory Carson as he explores the winding roads of Bumperton Hills.",Offering to the Storm,Thriller,"July 24, 2020",139,6.2,Spanish,True
255,s256,Movie,Memories of a Murderer: The Nilsen Tapes,Michael Harte,Unknown,Unknown,"August 18, 2021",2021,TV-MA,No data,"Documentaries, International Movies",Serial killer Dennis Nilsen narrates his life and horrific crimes via a series of chilling audiotapes recorded from his jail cell.,Roxanne Roxanne,Biopic,"March 23, 2018",98,6.2,English,True
256,s257,Movie,Nneka The Pretty Serpent,Tosin Igho,"Idia Aisien, Ndidi Obi, Kenneth Okolie, Zack Orji, Bovi Ugboma, Bimbo Ademoye, Beverly Osu, Beverly Naya, Larry Gaaga, Shaffy Bello, Chioma Chukwuka Akpotha, Waje",Unknown,"August 18, 2021",2020,TV-14,140 min,"Dramas, International Movies","Years after the mysterious murder of her parents, a traumatized woman gains supernatural powers that aid in her quest for revenge against the killers.",Someone Great,Romantic comedy,"April 19, 2019",92,6.2,English,True
257,s258,Movie,O Kadhal Kanmani,Mani Ratnam,"Dulquer Salmaan, Nithya Menon, Prakash Raj, Leela Samson, Vinodhini, Ramya Subramanian, Siva Ananth, John Devasahayam, Prabhu Lakshman",Unknown,"August 18, 2021",2015,TV-14,133 min,"Dramas, International Movies, Romantic Movies","It's love at first sight for a young couple repelled by the concept of marriage, but their view shifts when they meet their older-couple neighbors.",Spenser Confidential,Action comedy,"March 6, 2020",111,6.2,English,True
258,s259,Movie,Out of my league,Alice Filippi,"Ludovica Francesconi, Giuseppe Maggio, Gaja Masciale, Jozef Gjura, Eleonora Gaggero, Franco Ravera, Elisabetta Coraini, Michele Franco, Edoardo Rossi",Unknown,"August 18, 2021",2020,TV-MA,No data,"Comedies, Dramas, International Movies","Tired of swiping through the dating scene with her besties in tow, a charming yet awkward woman with a rare genetic disorder sets her sights on love.",The Land of Steady Habits,Drama,"September 14, 2018",98,6.2,English,True
259,s260,Movie,Pahuna,Paakhi Tyrewala,"Anmol Limbu, Ishika Gurung, Manju Chettri, Banita Lagun, Binod Pradhan, Mahindra Bajgai, Rupa Tamang, Saran Rai","India, Nepal","August 18, 2021",2018,TV-PG,82 min,"Comedies, Dramas, International Movies","Fleeing unrest in their native Nepal, three young siblings separated from their parents must beat the odds to survive on their own in India.",The Rachel Divide,Documentary,"April 27, 2018",104,6.2,English,True
261,s262,Movie,The Secret Diary of an Exchange Student,Bruno Garotti,"Larissa Manoela, Thati Lopes, Bruno Montaleone, David Sherod James, Maiara Walsh, Flávia Garrafa, Kathy-Ann Hart, Ray Faiola, Noa Graham",Unknown,"August 18, 2021",2021,TV-14,No data,"Comedies, International Movies, Romantic Movies","Looking to shake things up, two best friends embark on a life-changing adventure abroad as exchange students. But can they stay out of trouble?",Win It All,Comedy,"April 7, 2017",88,6.2,English,True
262,s263,Movie,Untold: Deal With the Devil,Laura Brownson,Unknown,Unknown,"August 18, 2021",2021,TV-MA,78 min,"Documentaries, LGBTQ Movies, Sports Movies","Christy Martin broke boundaries and noses as she rose in the boxing world, but her public persona belied personal demons, abuse and a threat on her life.",1922,Horror/Crime drama,"October 20, 2017",102,6.3,English,True
263,s264,TV Show,Mother Goose Club,Unknown,Unknown,United States,"August 16, 2021",2016,TV-Y,2 Seasons,Kids' TV,Classic nursery rhymes and children's songs get a fresh twist in this high-energy program that helps kids learn as they dance and sing along.,A Tale of Two Kitchens,Documentary,"May 22, 2019",30,6.3,English/Spanish,True
264,s265,Movie,Walk of Shame,Steve Brill,"Elizabeth Banks, James Marsden, Gillian Jacobs, Sarah Wright, Ethan Suplee, Bill Burr, Ken Davitian, Lawrence Gilliard Jr., Alphonso Mcauley, Da'Vone McDonald, John Marsden, Willie Garson, Oliver Hudson, P.J. Byrne",United States,"August 16, 2021",2014,R,No data,"Comedies, Independent Movies","After a night of boozy carousing, a local newscaster finds herself stranded on the streets of LA just hours before the job interview of a lifetime.",Alex Strangelove,Romantic comedy,"June 8, 2018",99,6.3,English,True
265,s266,TV Show,Rascal Does Not Dream of Bunny Girl Senpai,Unknown,"Kaito Ishikawa, Asami Seto, Nao Toyama, Atsumi Tanezaki, Maaya Uchida, Yurika Kubo, Inori Minase",Japan,"August 15, 2021",2018,TV-14,No data,"Anime Series, International TV Shows, Romantic TV Shows","After experiencing ""puberty syndrome"" himself, high school pariah Sakuta keeps meeting girls suffering from it, including his sister and actor Mai.",Apostle,Horror-thriller,"October 12, 2018",129,6.3,English,True
266,s267,TV Show,The Creative Indians,Unknown,Unknown,India,"August 15, 2021",2020,TV-MA,No data,"Docuseries, International TV Shows","From chefs and comedians to filmmakers and fashion designers, India’s most notable imaginative minds share their artistic journeys.",Benji,Family film,"March 16, 2018",87,6.3,English,True
267,s268,Movie,The Piano,Jane Campion,"Holly Hunter, Harvey Keitel, Sam Neill, Anna Paquin, Kerry Walker, Genevieve Lemon, Tungia Baker, Ian Mune","New Zealand, Australia, France, United States","August 15, 2021",1993,R,121 min,"Classic Movies, Dramas, Independent Movies","With her daughter and her beloved piano in tow, a mute Scottish woman arrives in New Zealand, where a gruff loner sets out to seduce her.",Bright,Urban fantasy,"December 22, 2017",117,6.3,English,True
268,s269,Movie,Unroyal,Moses Inwang,"Matilda Lambert, Ik Ogbonna, Prince Sontoye, Blossom Chukwujekwu, Linda Osifo, Emem Inwang, Pete Edochie, Shaffy Bello, Okon Imeh  Bishop, Chinenye Nnebe, Femi Adebayo",Unknown,"August 15, 2021",2020,TV-MA,No data,"Dramas, International Movies","When a rude and arrogant princess finds herself relying on a gatekeeper after a terrible accident, it may be enough to make her change her ways.",Cargo,Drama/Horror,"May 18, 2018",104,6.3,English,True
269,s270,TV Show,Winx Club,Unknown,"Liza Jacqueline, Helena Evangeliou, Lisa Ortiz, Kerry Williams, Gregory Abbey, Dan Green, Michael Sinterniklaas, Suzy Myers, Christina Rodriguez, Dani Schaffel, Sebastian Arcelus, Rachael Lillis",Italy,"August 15, 2021",2015,TV-Y7,2 Seasons,Kids' TV,"In this animated fantasy, a girl named Bloom befriends a band of fairies, then follows them into the secretive and dangerous ""Magical Dimension.""",Concrete Cowboy,Drama,"April 2, 2021",111,6.3,English,True
270,s271,Movie,Beckett,Ferdinando Cito Filomarino,"John David Washington, Boyd Holbrook, Alicia Vikander, Vicky Krieps, Lena Kitsopoulou, Panos Koronis, Maria Votti","Italy, Brazil, Greece","August 13, 2021",2021,TV-MA,110 min,Action & Adventure,An American tourist goes on the run in Greece after a tragic accident plunges him into a political conspiracy that makes him a target for assassination.,Feel the Beat,Family/Comedy-drama,"June 19, 2020",107,6.3,English,True
271,s272,TV Show,Brand New Cherry Flavor,Unknown,"Rosa Salazar, Eric Lange, Catherine Keener, Jeff Ward, Manny Jacinto, Hannah Levien, Patrick Fischler",United States,"August 13, 2021",2021,TV-MA,No data,"TV Dramas, TV Horror, TV Mysteries","A filmmaker heads to Hollywood in the early '90s to make her movie but tumbles down a hallucinatory rabbit hole of sex, magic, revenge — and kittens.",Get the Goat,Comedy,"March 18, 2021",97,6.3,Portuguese,True
273,s274,TV Show,Gone for Good,Juan Carlos Medina,"Finnegan Oldfield, Nicolas Duvauchelle, Guillaume Gouix, Garance Marillier, Nailia Harzoune",France,"August 13, 2021",2021,TV-MA,No data,"Crime TV Shows, International TV Shows, TV Dramas","Ten years after losing two loved ones, a man is plunged into another dizzying mystery when his girlfriend vanishes. Based on a Harlan Coben novel.",June & Kopi,Drama,"January 28, 2021",90,6.3,Indonesian,True
274,s275,TV Show,Grace and Frankie,Unknown,"Jane Fonda, Lily Tomlin, Martin Sheen, Sam Waterston, June Diane Raphael, Brooklyn Decker, Ethan Embry, Baron Vaughn",United States,"August 13, 2021",2021,TV-MA,7 Seasons,"TV Comedies, TV Dramas","They’re not friends, but when their husbands leave them for each other, proper Grace and eccentric Frankie begin to bond in this Emmy-nominated series.",Music Teacher,Drama,"April 19, 2019",101,6.3,Hindi,True
275,s276,TV Show,The Kingdom,Unknown,"Chino Darín, Nancy Dupláa, Joaquín Furriel, Peter Lanzani, Mercedes Morán, Diego Peretti, Vera Spinetta, Nico García Hume, Victoria Almeida, Santiago Korovsky, Patricio Aramburu, Alfonso Tort, Diego Gentile, Néstor Guzzini, Daniel Kuzniecka",Argentina,"August 13, 2021",2021,TV-MA,No data,"Crime TV Shows, International TV Shows, Spanish-Language TV Shows","After his running mate's murder, a controversial televangelist becomes Argentina's presidential candidate. But nothing about him is as holy as he seems.",Nail Bomber: Manhunt,Documentary,"May 26, 2021",72,6.3,English,True
276,s277,TV Show,Valeria,Inma Torrente,"Diana Gómez, Silma López, Paula Malia, Teresa Riott, Maxi Iglesias, Ibrahim Al Shami",Spain,"August 13, 2021",2021,TV-MA,2 Seasons,"International TV Shows, Romantic TV Shows, Spanish-Language TV Shows","A writer in creative and marital crises finds support from three friends, who are also discovering themselves. Based on the novels by Elísabet Benavent.",Notes for My Son,Drama,"November 24, 2020",83,6.3,Spanish,True
277,s278,TV Show,AlRawabi School for Girls,Unknown,"Andria Tayeh, Rakeen Sa'ad, Noor Taher, Yara Mustafa, Joanna Arida, Salsabiela, Nadera Emran, Reem Saadeh",Jordan,"August 12, 2021",2021,TV-14,No data,"International TV Shows, TV Dramas, Teen TV Shows",The bullied outcasts at prestigious Al Rawabi School for Girls plot a series of risky takedowns to get back at their tormentors.,Polar,Action,"January 25, 2019",118,6.3,English,True
279,s280,Movie,Monster Hunter: Legends of the Guild,Steven Yamamoto,"Ben Rausch, Erica Lindbeck, Dante Basco, Brando Eaton, Stephen Kramer Glickman, Caroline Caliston, G.K. Bowes, Dan McCoy","United States, Japan","August 12, 2021",2021,TV-PG,59 min,"Action & Adventure, Anime Features, Children & Family Movies","In a world where humans and fearsome monsters live in an uneasy balance, young hunter Aiden fights to save his village from destruction by a dragon.",Sand Castle,War,"April 21, 2017",113,6.3,English,True
280,s281,TV Show,Bake Squad,Unknown,Unknown,United States,"August 11, 2021",2021,TV-PG,No data,Reality TV,Expert bakers elevate desserts with next-level ideas and epic execution. Now the battle is on to win over clients in need of very special sweets.,Shimmer Lake,Crime thriller,"June 9, 2017",86,6.3,English,True
281,s282,Movie,Brother Jekwu,Charles Uwagbai,"Mike Ezuruonye, Juliet Ochienge, Angela Okorie, Huddah Monroe, Catherine Kamau, Naomi Mburu, Derrick Aduwo, Chris Kamau, Abubakar Salum, Celebrity Landlord",Nigeria,"August 11, 2021",2016,TV-14,No data,"Comedies, International Movies","Chasing wild success, a village hustler follows his cousin from Nigeria to Kenya and stumbles into the shady business affairs of a notorious overlord.",Spectral,Science fiction/Action,"December 9, 2016",108,6.3,English,True
282,s283,Movie,La diosa del asfalto,Julián Hernández,"Ximena Romo, Mabel Cadena, Alejandra Herrera, Nelly González, Samantha Orozco, Axel Arenas, Esteban Caicedo, Paulina Goto, Raquel Robles, Baby Bátiz, Pascacio López, Juán Carlos Torres, Javier Oliván, Claudia Lobo, Giovanna Zacarías",Mexico,"August 11, 2021",2020,TV-MA,127 min,"Dramas, Independent Movies, International Movies","A woman from a tough neighborhood outside Mexico City comes home a rock star, inadvertently provoking a confrontation with the ghosts of her past.",The Babysitter,Teen comedy horror,"October 13, 2017",85,6.3,English,True
283,s284,Movie,Misha and the Wolves,Sam Hobkinson,Unknown,"Belgium, United Kingdom","August 11, 2021",2021,PG-13,90 min,"Documentaries, International Movies","As a little girl, she escaped the Holocaust and lived among wolves. Or did she? An extraordinary story elicits sympathy — then draws scrutiny.",The Discovery,Science fiction/Drama,"March 31, 2017",102,6.3,English,True
284,s285,Movie,The Kissing Booth 3,Vince Marcello,"Joey King, Joel Courtney, Jacob Elordi, Molly Ringwald, Taylor Zakhar Perez, Maisie Richardson-Sellers, Meganne Young, Stephen Jennings","United Kingdom, United States","August 11, 2021",2021,TV-14,No data,"Comedies, Romantic Movies","Determined to make the most of her final summer before college, Elle plans the ultimate bucket list as she navigates what comes next with Noah and Lee.",The Forest of Love,Drama,"October 11, 2019",151,6.3,Japanese,True
285,s286,Movie,The Railway Man,Jonathan Teplitzky,"Colin Firth, Nicole Kidman, Jeremy Irvine, Stellan Skarsgård, Sam Reid, Hiroyuki Sanada, Michael MacKenzie, Tom Stokes","Switzerland, United Kingdom, Australia","August 11, 2021",2013,R,No data,"Dramas, International Movies","Decades after World War II, a still-shattered soldier unexpectedly falls in love and sees a bizarre coincidence bring his past back into focus.",The Laundromat,Comedy-drama,"October 18, 2019",98,6.3,English,True
286,s287,TV Show,Gabby's Dollhouse,Unknown,"Laila Lockhart Kraner, Tucker Chandler, Juliet Donenfeld, Maggi Lowe, Donovan Patton, Eduardo Franco, Tara Strong, Secunda Wood, Carla Tassara, Sainty Nelsen",United States,"August 10, 2021",2021,TV-Y,2 Seasons,Kids' TV,"Cute cats, quirky crafts and colorful magic! Join kitty enthusiast Gabby and her sidekick Pandy Paws as they team up for a series of animated adventures.",The Legend of Cocaine Island,Documentary,"March 29, 2019",87,6.3,English,True
287,s288,TV Show,I Need Romance,Sakon Tiacharoen,"Khemanit Jamikorn, Thitipoom Techaapaikhun, Kannaporn Puangthong, Premmanat Suwannanon, Mintita Wattanakul, Thames Sanpakit, Katareeya Theapchatri, Phanuroj Chalermkijporntavee, Jirapisit Jaravijit",Unknown,"August 10, 2021",2021,TV-14,No data,"International TV Shows, Romantic TV Shows, TV Comedies","A workaholic who lost interest in romance reunites with an old flame and gifted music composer, who's determined to restore her belief in love.",The Outsider,Crime drama,"March 9, 2018",120,6.3,English/Japanese,True
288,s289,TV Show,Las muñecas de la mafia,Unknown,"Amparo Grisales, Fernando Solórzano, Angelica Blandon, Katherine Escobar, Yuly Ferreira, Alejandra Sandoval, Andrea Gómez, Andrea Guzmán, Diego Vásquez, Julián Román, Juan Pablo Franco",Colombia,"August 10, 2021",2018,TV-MA,No data,"Crime TV Shows, International TV Shows, Spanish-Language TV Shows","Based on the book ""Las Fantásticas,"" this exciting telenovela follows the tumultuous lives of five women who get mixed up with the Mafia.",Time to Hunt,Thriller,"April 23, 2020",134,6.3,Korean,True
290,s291,Movie,Untold: Malice at the Palace,Floyd Russ,Unknown,United States,"August 10, 2021",2021,TV-MA,70 min,"Documentaries, Sports Movies","Key figures from an infamous 2004 incident between players and fans at an NBA game in Michigan discuss the fight, its fallout and its lasting legacy.",Travis Scott: Look Mom I Can Fly,Documentary,"August 28, 2019",85,6.3,English,True
291,s292,TV Show,SHAMAN KING,Unknown,"Yoko Hikasa, Katsuyuki Konishi, Megumi Hayashibara, Inuko Inuyama, Romi Park, Kosuke Takaguchi, Masahiko Tanaka, Wataru Takagi, Yuji Ueda, Megumi Nakajima, Takehito Koyasu, Yoko Soumi, Motoko Kumai, Yui Horie, Yuichi Nakamura, Nana Mizuki, Takumu Miyazono, Noriaki Kanze, Michiko Neya, Toru Sakurai, Rina Hidaka, Masakazu Morita, Minami Takayama",Japan,"August 9, 2021",2021,TV-14,No data,"Anime Series, International TV Shows","Medium Yoh Asakura enters a battle tournament held every 500 years, competing with other shamans in a bid to become the all-powerful Shaman King.",Uncorked,Drama,"March 27, 2020",103,6.3,English,True
292,s293,Movie,Quartet,Dustin Hoffman,"Maggie Smith, Tom Courtenay, Billy Connolly, Pauline Collins, Michael Gambon, Andrew Sachs, Sheridan Smith, David Ryall, Trevor Peacock, Gwyneth Jones",United Kingdom,"August 8, 2021",2012,PG-13,98 min,"Comedies, Dramas, Independent Movies","To save their posh retirement home, former opera stars plan a gala recital — until the biggest diva among them refuses to sing.",Anelka: Misunderstood,Documentary,"August 5, 2020",94,6.4,French,True
