Unnamed: 0,show_id,type,title,director,cast,country,date_added,release_year,rating,duration,listed_in,description,Title,Genre,Premiere,Runtime,IMDB Score,Language,is_original
0,s1,Movie,Dick Johnson Is Dead,Kirsten Johnson,Unknown,United States,"September 25, 2021",2020,PG-13,90 min,Documentaries,"As her father nears the end of his life, filmmaker Kirsten Johnson stages his death in inventive and comical ways to help them both face the inevitable.",Enter the Anime,Documentary,"August 5, 2019",58,2.5,English/Japanese,True
1,s2,TV Show,Blood & Water,Unknown,"Ama Qamata, Khosi Ngema, Gail Mabalane, Thabang Molaba, Dillon Windvogel, Natasha Thahane, Arno Greeff, Xolile Tshabalala, Getmore Sithole, Cindy Mahlangu, Ryle De Morny, Greteli Fincham, Sello Maake Ka-Ncube, Odwa Gwanya, Mekaila Mathys, Sandi Schultz, Duane Williams, Shamilla Miller, Patrick Mofokeng",South Africa,"September 24, 2021",2021,TV-MA,2 Seasons,"International TV Shows, TV Dramas, TV Mysteries","After crossing paths at a party, a Cape Town teen sets out to prove whether a private-school swimming star is her sister who was abducted at birth.",Dark Forces,Thriller,"August 21, 2020",81,2.6,Spanish,True
2,s3,TV Show,Ganglands,Julien Leclercq,"Sami Bouajila, Tracy Gotoas, Samuel Jouy, Nabiha Akkari, Sofia Lesaffre, Salim Kechiouche, Noureddine Farihi, Geert Van Rampelberg, Bakary Diombera",Unknown,"September 24, 2021",2021,TV-MA,No data,"Crime TV Shows, International TV Shows, TV Action & Adventure","To protect his family from a powerful drug lord, skilled thief Mehdi and his expert team of robbers are pulled into a violent and deadly turf war.",The App,Science fiction/Drama,"December 26, 2019",79,2.6,Italian,True
3,s4,TV Show,Jailbirds New Orleans,Unknown,Unknown,Unknown,"September 24, 2021",2021,TV-MA,No data,"Docuseries, Reality TV","Feuds, flirtations and toilet talk go down among the incarcerated women at the Orleans Justice Center in New Orleans on this gritty reality series.",The Open House,Horror thriller,"January 19, 2018",94,3.2,English,True
4,s5,TV Show,Kota Factory,Unknown,"Mayur More, Jitendra Kumar, Ranjan Raj, Alam Khan, Ahsaas Channa, Revathi Pillai, Urvi Singh, Arun Kumar",India,"September 24, 2021",2021,TV-MA,2 Seasons,"International TV Shows, Romantic TV Shows, TV Comedies","In a city of coaching centers known to train India’s finest collegiate minds, an earnest but unexceptional student and his friends navigate campus life.",Kaali Khuhi,Mystery,"October 30, 2020",90,3.4,Hindi,True
5,s6,TV Show,Midnight Mass,Mike Flanagan,"Kate Siegel, Zach Gilford, Hamish Linklater, Henry Thomas, Kristin Lehman, Samantha Sloyan, Igby Rigney, Rahul Kohli, Annarah Cymone, Annabeth Gish, Alex Essoe, Rahul Abburi, Matt Biedel, Michael Trucco, Crystal Balint, Louis Oliver",Unknown,"September 24, 2021",2021,TV-MA,No data,"TV Dramas, TV Horror, TV Mysteries","The arrival of a charismatic young priest brings glorious miracles, ominous mysteries and renewed religious fervor to a dying town desperate to believe.",Drive,Action,"November 1, 2019",147,3.5,Hindi,True
6,s7,Movie,My Little Pony: A New Generation,"Robert Cullen, José Luis Ucha","Vanessa Hudgens, Kimiko Glenn, James Marsden, Sofia Carson, Liza Koshy, Ken Jeong, Elizabeth Perkins, Jane Krakowski, Michael McKean, Phil LaMarr",Unknown,"September 24, 2021",2021,PG,No data,Children & Family Movies,"Equestria's divided. But a bright-eyed hero believes Earth Ponies, Pegasi and Unicorns should be pals — and, hoof to heart, she’s determined to prove it.",Leyla Everlasting,Comedy,"December 4, 2020",112,3.7,Turkish,True
7,s8,Movie,Sankofa,Haile Gerima,"Kofi Ghanaba, Oyafunmike Ogunlano, Alexandra Duah, Nick Medley, Mutabaruka, Afemo Omilami, Reggie Carter, Mzuri","United States, Ghana, Burkina Faso, United Kingdom, Germany, Ethiopia","September 24, 2021",1993,TV-MA,125 min,"Dramas, Independent Movies, International Movies","On a photo shoot in Ghana, an American model slips back in time, becomes enslaved on a plantation and bears witness to the agony of her ancestral past.",The Last Days of American Crime,Heist film/Thriller,"June 5, 2020",149,3.7,English,True
8,s9,TV Show,The Great British Baking Show,Andy Devonshire,"Mel Giedroyc, Sue Perkins, Mary Berry, Paul Hollywood",United Kingdom,"September 24, 2021",2021,TV-14,9 Seasons,"British TV Shows, Reality TV","A talented batch of amateur bakers face off in a 10-week competition, whipping up their best dishes in the hopes of being named the U.K.'s best.",Paradox,Musical/Western/Fantasy,"March 23, 2018",73,3.9,English,True
9,s10,Movie,The Starling,Theodore Melfi,"Melissa McCarthy, Chris O'Dowd, Kevin Kline, Timothy Olyphant, Daveed Diggs, Skyler Gisondo, Laura Harrier, Rosalind Chao, Kimberly Quinn, Loretta Devine, Ravi Kapoor",United States,"September 24, 2021",2021,PG-13,104 min,"Comedies, Dramas",A woman adjusting to life after a loss contends with a feisty bird that's taken over her garden — and a husband who's struggling to find a way forward.,Sardar Ka Grandson,Comedy,"May 18, 2021",139,4.1,Hindi,True
11,s12,TV Show,Bangkok Breaking,Kongkiat Komesiri,"Sukollawat Kanarot, Sushar Manaying, Pavarit Mongkolpisit, Sahajak Boonthanakit, Suthipongse Thatphithakkul, Bhasaworn Bawronkirati, Daweerit Chullasapya, Waratthaya Wongchayaporn, Kittiphoom Wongpentak, Abhicha Thanachanun, Nophand Boonyai, Kittipong Khamsat, Arisara Wongchalee, Jaytiya Naiwattanakul, Pantipa Arunwattanachai, Panupan Jantanawong, Kungtap Saelim, Phumphat Chartsuriyakiat, Issara Veranitinunt, Keerati Sivakuae, Panjai Sirisuwan, Supranee Charoenpol, Suda Chuenban, Visaka Banhansupavat, Pitchatorn Santinatornkul",Unknown,"September 23, 2021",2021,TV-MA,No data,"Crime TV Shows, International TV Shows, TV Action & Adventure","Struggling to earn a living in Bangkok, a man joins an emergency rescue service and realizes he must unravel a citywide conspiracy.",The Call,Drama,"November 27, 2020",112,4.1,Korean,True
12,s13,Movie,Je Suis Karl,Christian Schwochow,"Luna Wedler, Jannis Niewöhner, Milan Peschel, Edin Hasanović, Anna Fialová, Marlon Boess, Victor Boccard, Fleur Geffrier, Aziz Dyab, Mélanie Fouché, Elizaveta Maximová","Germany, Czech Republic","September 23, 2021",2021,TV-MA,127 min,"Dramas, International Movies","After most of her family is murdered in a terrorist bombing, a young woman is unknowingly lured into joining the very group that killed them.",Whipped,Romantic comedy,"September 18, 2020",97,4.1,Indonesian,True
13,s14,Movie,Confessions of an Invisible Girl,Bruno Garotti,"Klara Castanho, Lucca Picon, Júlia Gomes, Marcus Bessa, Kiria Malheiros, Fernanda Concon, Gabriel Lima, Caio Cabral, Leonardo Cidade, Jade Cardozo",Unknown,"September 22, 2021",2021,TV-PG,No data,"Children & Family Movies, Comedies","When the clever but socially-awkward Tetê joins a new school, she'll do anything to fit in. But the queen bee among her classmates has other ideas.",All Because of You,Action comedy,"October 1, 2020",101,4.2,Malay,True
14,s15,TV Show,Crime Stories: India Detectives,Unknown,Unknown,Unknown,"September 22, 2021",2021,TV-MA,No data,"British TV Shows, Crime TV Shows, Docuseries",Cameras following Bengaluru police on the job offer a rare glimpse into the complex and challenging inner workings of four major crime investigations.,Mercy,Thriller,"November 22, 2016",90,4.2,English,True
15,s16,TV Show,Dear White People,Unknown,"Logan Browning, Brandon P. Bell, DeRon Horton, Antoinette Robertson, John Patrick Amedori, Ashley Blaine Featherson, Marque Richardson, Giancarlo Esposito",United States,"September 22, 2021",2021,TV-MA,No data,"TV Comedies, TV Dramas","Students of color navigate the daily slights and slippery politics of life at an Ivy League college that's not nearly as ""post-racial"" as it thinks.",After the Raid,Documentary,"December 19, 2019",25,4.3,Spanish,True
16,s17,Movie,Europe's Most Dangerous Man: Otto Skorzeny in Spain,"Pedro de Echave García, Pablo Azorín Williams",Unknown,Unknown,"September 22, 2021",2020,TV-MA,No data,"Documentaries, International Movies","Declassified documents reveal the post-WWII life of Otto Skorzeny, a close Hitler ally who escaped to Spain and became an adviser to world presidents.",Ghost Stories,Horror anthology,"January 1, 2020",144,4.3,Hindi,True
17,s18,TV Show,Falsa identidad,Unknown,"Luis Ernesto Franco, Camila Sodi, Sergio Goyri, Samadhi Zendejas, Eduardo Yáñez, Sonya Smith, Alejandro Camacho, Azela Robinson, Uriel del Toro, Géraldine Bazán, Gabriela Roel, Marcus Ornellas",Mexico,"September 22, 2021",2020,TV-MA,2 Seasons,"Crime TV Shows, Spanish-Language TV Shows, TV Dramas",Strangers Diego and Isabel flee their home in Mexico and pretend to be a married couple to escape his drug-dealing enemies and her abusive husband.,The Last Thing He Wanted,Political thriller,"February 21, 2020",115,4.3,English,True
18,s19,Movie,Intrusion,Adam Salky,"Freida Pinto, Logan Marshall-Green, Robert John Burke, Megan Elisabeth Kelly, Sarah Minnich, Hayes Hargrove, Mark Sivertsen, Brandon Fierro, Antonio Valles, Clint Obenchain",Unknown,"September 22, 2021",2021,TV-14,No data,Thrillers,"After a deadly home invasion at a couple’s new dream house, the traumatized wife searches for answers — and learns the real danger is just beginning.",What Happened to Mr. Cha?,Comedy,"January 1, 2021",102,4.3,Korean,True
19,s20,TV Show,Jaguar,Unknown,"Blanca Suárez, Iván Marcos, Óscar Casas, Adrián Lastra, Francesc Garrido, Stefan Weinert, Julia Möller, Alicia Chojnowski",Unknown,"September 22, 2021",2021,TV-MA,No data,"International TV Shows, Spanish-Language TV Shows, TV Action & Adventure","In the 1960s, a Holocaust survivor joins a group of self-trained spies who seek justice against Nazis fleeing to Spain to hide after WWII.",Death Note,Horror thriller,"August 25, 2017",100,4.4,English,True
21,s22,TV Show,Resurrection: Ertugrul,Unknown,"Engin Altan Düzyatan, Serdar Gökhan, Hülya Darcan, Kaan Taşaner, Esra Bilgiç, Osman Soykut, Serdar Deniz, Cengiz Coşkun, Reshad Strik, Hande Subaşı",Turkey,"September 22, 2021",2018,TV-14,No data,"International TV Shows, TV Action & Adventure, TV Dramas","When a good deed unwittingly endangers his clan, a 13th-century Turkish warrior agrees to fight a sultan's enemies in exchange for new tribal land.",Secret Obsession,Thriller,"July 18, 2019",97,4.4,English,True
22,s23,Movie,Avvai Shanmughi,K.S. Ravikumar,"Kamal Hassan, Meena, Gemini Ganesan, Heera Rajgopal, Nassar, S.P. Balasubrahmanyam",Unknown,"September 21, 2021",1996,TV-PG,161 min,"Comedies, International Movies","Newly divorced and denied visitation rights with his daughter, a doting father disguises himself as a gray-haired nanny in order to spend time with her.",Sextuplets,Comedy,"August 16, 2019",99,4.4,English,True
23,s24,Movie,Go! Go! Cory Carson: Chrissy Takes the Wheel,"Alex Woo, Stanley Moore","Maisie Benson, Paul Killam, Kerry Gudjohnsen, AC Lim",Unknown,"September 21, 2021",2021,TV-Y,61 min,Children & Family Movies,"From arcade games to sled days and hiccup cures, Cory Carson’s curious little sister Chrissy speeds off on her own for fun and adventure all over town!",The Girl on the Train,Thriller,"February 26, 2021",120,4.4,Hindi,True
24,s25,Movie,Jeans,S. Shankar,"Prashanth, Aishwarya Rai Bachchan, Sri Lakshmi, Nassar",India,"September 21, 2021",1998,TV-14,166 min,"Comedies, International Movies, Romantic Movies","When the father of the man she loves insists that his twin sons marry twin sisters, a woman creates an alter ego that might be a bit too convincing.",Thunder Force,Superhero-Comedy,"April 9, 2021",105,4.4,English,True
25,s26,TV Show,Love on the Spectrum,Unknown,Brooke Satchwell,Australia,"September 21, 2021",2021,TV-14,2 Seasons,"Docuseries, International TV Shows, Reality TV","Finding love can be hard for anyone. For young adults on the autism spectrum, exploring the unpredictable world of dating is even more complicated.",Fatal Affair,Thriller,"July 16, 2020",89,4.5,English,True
26,s27,Movie,Minsara Kanavu,Rajiv Menon,"Arvind Swamy, Kajol, Prabhu Deva, Nassar, S.P. Balasubrahmanyam, Girish Karnad",Unknown,"September 21, 2021",1997,TV-PG,147 min,"Comedies, International Movies, Music & Musicals",A tangled love triangle ensues when a man falls for a woman studying to become a nun — and she falls for the friend he enlists to help him pursue her.,Just Say Yes,Romantic comedy,"April 2, 2021",97,4.5,Dutch,True
27,s28,Movie,Grown Ups,Dennis Dugan,"Adam Sandler, Kevin James, Chris Rock, David Spade, Rob Schneider, Salma Hayek, Maria Bello, Maya Rudolph, Colin Quinn, Tim Meadows, Joyce Van Patten",United States,"September 20, 2021",2010,PG-13,No data,Comedies,"Mourning the loss of their beloved junior high basketball coach, five middle-aged pals reunite at a lake house and rediscover the joys of being a kid.",Seriously Single,Comedy,"July 31, 2020",107,4.5,English,True
28,s29,Movie,Dark Skies,Scott Stewart,"Keri Russell, Josh Hamilton, J.K. Simmons, Dakota Goyo, Kadan Rockett, L.J. Benet, Rich Hutchman, Myndy Crist, Annie Thurman, Jake Brennan",United States,"September 19, 2021",2013,PG-13,No data,"Horror Movies, Sci-Fi & Fantasy","A family’s idyllic suburban life shatters when an alien force invades their home, and as they struggle to convince others of the deadly threat.",The Misadventures of Hedi and Cokeman,Comedy,"February 10, 2021",99,4.5,French,True
29,s30,Movie,Paranoia,Robert Luketic,"Liam Hemsworth, Gary Oldman, Amber Heard, Harrison Ford, Lucas Till, Embeth Davidtz, Julian McMahon, Josh Holloway, Richard Dreyfuss, Angela Sarafyan","United States, India, France","September 19, 2021",2013,PG-13,No data,Thrillers,"Blackmailed by his company's CEO, a low-level employee finds himself forced to spy on the boss's rival and former mentor.",5 Star Christmas,Comedy,"December 7, 2018",95,4.6,Italian,True
30,s31,Movie,Ankahi Kahaniya,"Ashwiny Iyer Tiwari, Abhishek Chaubey, Saket Chaudhary","Abhishek Banerjee, Rinku Rajguru, Delzad Hiwale, Kunal Kapoor, Zoya Hussain, Nikhil Dwivedi, Palomi Ghosh",Unknown,"September 17, 2021",2021,TV-14,111 min,"Dramas, Independent Movies, International Movies","As big city life buzzes around them, lonely souls discover surprising sources of connection and companionship in three tales of love, loss and longing.",After Maria,Documentary,"May 24, 2019",37,4.6,English/Spanish,True
31,s32,TV Show,Chicago Party Aunt,Unknown,"Lauren Ash, Rory O'Malley, RuPaul Charles, Jill Talley, Ike Barinholtz, Jon Barinholtz, Matthew Craig, Bob Odenkirk, Mike Hagerty, Katie Rich, Chris Witaske",Unknown,"September 17, 2021",2021,TV-MA,No data,TV Comedies,Chicago Party Aunt Diane is an idolized troublemaker with a talent for avoiding adulthood — and a soft spot for her soul-searching nephew.,I Am the Pretty Thing That Lives in the House,Horror,"October 28, 2016",89,4.6,English,True
32,s33,TV Show,Sex Education,Unknown,"Asa Butterfield, Gillian Anderson, Ncuti Gatwa, Emma Mackey, Connor Swindells, Kedar Williams-Stirling, Alistair Petrie",United Kingdom,"September 17, 2021",2020,TV-MA,No data,"British TV Shows, International TV Shows, TV Comedies","Insecure Otis has all the answers when it comes to sex advice, thanks to his therapist mom. So rebel Maeve proposes a school sex-therapy clinic.",Paris Is Us,Romance drama,"February 22, 2019",83,4.6,French,True
34,s35,TV Show,Tayo and Little Wizards,Unknown,"Dami Lee, Jason Lee, Bommie Catherine Han, Jennifer Waescher, Nancy Kim",Unknown,"September 17, 2021",2020,TV-Y7,No data,Kids' TV,Tayo speeds into an adventure when his friends get kidnapped by evil magicians invading their city in search of a magical gemstone.,Rattlesnake,Horror,"October 25, 2019",85,4.6,English,True
35,s36,Movie,The Father Who Moves Mountains,Daniel Sandu,"Adrian Titieni, Elena Purea, Judith State, Valeriu Andriuță, Tudor Smoleanu, Virgil Aioanei, Radu Botar, Petronela Grigorescu, Bogdan Nechifor, Cristian Bota",Unknown,"September 17, 2021",2021,TV-MA,110 min,"Dramas, International Movies, Thrillers","When his son goes missing during a snowy hike in the mountains, a retired intelligence officer will stop at nothing — and risk everything — to find him.",The Players,Comedy,"July 15, 2020",88,4.6,Italian,True
36,s37,Movie,The Stronghold,Cédric Jimenez,"Gilles Lellouche, Karim Leklou, François Civil, Adèle Exarchopoulos, Kenza Fortas, Cyril Lecomte, Michaël Abiteboul, Idir Azougli, Vincent Darmuzey, Jean-Yves Berteloot",Unknown,"September 17, 2021",2021,TV-MA,No data,"Action & Adventure, Dramas, International Movies","Tired of the small-time grind, three Marseille cops get a chance to bust a major drug network. But lines blur when a key informant makes a big ask.",We Are One,Documentary,"July 14, 2020",86,4.6,French,True
37,s38,TV Show,Angry Birds,Unknown,"Antti Pääkkönen, Heljä Heikkinen, Lynne Guaglione, Pasi Ruohonen, Rauno Ahonen",Finland,"September 16, 2021",2018,TV-Y7,No data,"Kids' TV, TV Comedies","Birds Red, Chuck and their feathered friends have lots of adventures while guarding eggs in their nest that pesky pigs keep trying to steal.",Finding Agnes,Drama,"November 30, 2020",105,4.7,Filipino,True
38,s39,Movie,Birth of the Dragon,George Nolfi,"Billy Magnussen, Ron Yuan, Qu Jingjing, Terry Chen, Vanness Wu, Jin Xing, Philip Ng, Xia Yu, Yu Xia","China, Canada, United States","September 16, 2021",2017,PG-13,No data,"Action & Adventure, Dramas","A young Bruce Lee angers kung fu traditionalists by teaching outsiders, leading to a showdown with a Shaolin master in this film based on real events.",IO,Science fiction/Drama,"January 18, 2019",95,4.7,English,True
39,s40,TV Show,Chhota Bheem,Unknown,"Vatsal Dubey, Julie Tejwani, Rupa Bhimani, Jigna Bhardwaj, Rajesh Kava, Mousam, Swapnil",India,"September 16, 2021",2021,TV-Y7,No data,Kids' TV,"A brave, energetic little boy with superhuman powers leads his friends on exciting adventures to guard their fellow Dholakpur villagers from evil.",Sentinelle,Action,"March 5, 2021",80,4.7,French,True
40,s41,TV Show,He-Man and the Masters of the Universe,Unknown,"Yuri Lowenthal, Kimberly Brooks, Antony Del Rio, Trevor Devall, Ben Diskin, Grey Griffin, David Kaye, Tom Kenny, Judy Alice Lee, Roger Craig Smith, Fred Tatasciore",United States,"September 16, 2021",2021,TV-Y7,No data,"Kids' TV, TV Sci-Fi & Fantasy",Mighty teen Adam and his heroic squad of misfits discover the legendary power of Grayskull — and their destiny to defend Eternia from sinister Skeletor.,Sol Levante,Anime / Short,"April 2, 2020",4,4.7,English,True
41,s42,Movie,Jaws,Steven Spielberg,"Roy Scheider, Robert Shaw, Richard Dreyfuss, Lorraine Gary, Murray Hamilton, Carl Gottlieb, Jeffrey Kramer, Susan Backlinie, Jonathan Filley, Ted Grossman",United States,"September 16, 2021",1975,PG,124 min,"Action & Adventure, Classic Movies, Dramas","When an insatiable great white shark terrorizes Amity Island, a police chief, an oceanographer and a grizzled shark hunter seek to destroy the beast.",The Binding,Drama,"October 2, 2020",93,4.7,Italian,True
42,s43,Movie,Jaws 2,Jeannot Szwarc,"Roy Scheider, Lorraine Gary, Murray Hamilton, Joseph Mascolo, Jeffrey Kramer, Collin Wilcox Paxton, Ann Dusenberry, Mark Gruner, Barry Coe, Susan French",United States,"September 16, 2021",1978,PG,116 min,"Dramas, Horror Movies, Thrillers","Four years after the last deadly shark attacks, police chief Martin Brody fights to protect Amity Island from another killer great white.",We Can Be Heroes,Superhero,"December 25, 2020",100,4.7,English,True
43,s44,Movie,Jaws 3,Joe Alves,"Dennis Quaid, Bess Armstrong, Simon MacCorkindale, Louis Gossett Jr., John Putch, Lea Thompson, P.H. Moriarty, Dan Blasko, Liz Morris, Lisa Maurer",United States,"September 16, 2021",1983,PG,98 min,"Action & Adventure, Horror Movies, Thrillers","After the staff of a marine theme park try to capture a young great white shark, they discover its mother has invaded the enclosure and is out for blood.",Christmas Crossfire,Thriller,"December 4, 2020",106,4.8,German,True
44,s45,Movie,Jaws: The Revenge,Joseph Sargent,"Lorraine Gary, Lance Guest, Mario Van Peebles, Karen Young, Michael Caine, Judith Barsi, Mitchell Anderson, Lynn Whitfield",United States,"September 16, 2021",1987,PG-13,No data,"Action & Adventure, Horror Movies, Thrillers","After another deadly shark attack, Ellen Brody has had enough of Amity Island and moves to the Caribbean – but a great white shark follows her there.",Coin Heist,Heist,"January 6, 2017",97,4.8,English,True
45,s46,Movie,My Heroes Were Cowboys,Tyler Greco,Unknown,Unknown,"September 16, 2021",2021,PG,23 min,Documentaries,"Robin Wiltshire's painful childhood was rescued by Westerns. Now he lives on the frontier of his dreams, training the horses he loves for the big screen.",Mrs. Serial Killer,Thriller,"May 1, 2020",106,4.8,Hindi,True
46,s47,Movie,Safe House,Daniel Espinosa,"Denzel Washington, Ryan Reynolds, Vera Farmiga, Brendan Gleeson, Sam Shepard, Rubén Blades, Nora Arnezeder, Robert Patrick, Liam Cunningham, Joel Kinnaman","South Africa, United States, Japan","September 16, 2021",2012,R,No data,Action & Adventure,Young CIA operative Matt Weston must get a dangerous criminal out of an agency safe house that's come under attack and get him to a securer location.,Nobody Sleeps in the Woods Tonight,Horror,"October 28, 2020",103,4.8,Polish,True
47,s48,TV Show,The Smart Money Woman,Bunmi Ajakaiye,"Osas Ighodaro, Ini Dima-Okojie, Kemi Lala Akindoju, Toni Tones, Ebenezer Eno, Eso Okolocha DIke, Patrick Diabuah, Karibi Fubara, Temisan Emmanuel, Timini Egbuson",Unknown,"September 16, 2021",2020,TV-MA,No data,"International TV Shows, Romantic TV Shows, TV Comedies","Five glamorous millennials strive for success as they juggle careers, finances, love and friendships. Based on Arese Ugwu's 2016 best-selling novel.",Take the 10,Comedy,"January 20, 2017",80,4.8,English,True
48,s49,Movie,Training Day,Antoine Fuqua,"Denzel Washington, Ethan Hawke, Scott Glenn, Tom Berenger, Harris Yulin, Raymond J. Barry, Cliff Curtis, Dr. Dre, Snoop Dogg, Macy Gray, Eva Mendes",United States,"September 16, 2021",2001,R,122 min,"Dramas, Thrillers",A rookie cop with one day to prove himself to a veteran LAPD narcotics officer receives a crash course in his mentor's questionable brand of justice.,The Main Event,Comedy,"April 10, 2020",101,4.8,English,True
49,s50,TV Show,Castle and Castle,Unknown,"Richard Mofe-Damijo, Dakore Akande, Bimbo Manuel, Blossom Chukwujekwu, Deyemi Okanlawon, Etim Effiong, Denola Grey, Duke Akintola, Eku Edewor, Ade Laoye, Anee Icha, Kevin Ushi, Jude Chukwuka, Amanda Afolabi",Nigeria,"September 15, 2021",2021,TV-MA,2 Seasons,"International TV Shows, TV Dramas","A pair of high-powered, successful lawyers find themselves defending opposite interests of the justice system, causing a strain on their happy marriage.",The Ridiculous 6,Western,"December 11, 2015",119,4.8,English,True
50,s51,TV Show,Dharmakshetra,Unknown,"Kashmira Irani, Chandan Anand, Dinesh Mehta, Ankit Arora, Pushkar Goggiaa, Anjali Rana, Aarya DharmChand Kumar, Amit Behl, Maleeka Ghai",India,"September 15, 2021",2014,TV-PG,No data,"International TV Shows, TV Dramas, TV Sci-Fi & Fantasy","After the ancient Great War, the god Chitragupta oversees a trial to determine who were the battle's true heroes and villains.",Earth and Blood,Action,"April 17, 2020",80,4.9,French,True
51,s52,Movie,InuYasha the Movie 2: The Castle Beyond the Looking Glass,Toshiya Shinohara,"Kappei Yamaguchi, Satsuki Yukino, Mieko Harada, Koji Tsujitani, Houko Kuwashima, Kumiko Watanabe, Noriko Hidaka, Kenichi Ogata, Toshiyuki Morikawa, Izumi Ogami",Japan,"September 15, 2021",2002,TV-14,No data,"Action & Adventure, Anime Features, International Movies","With their biggest foe seemingly defeated, InuYasha and his friends return to everyday life. But the peace is soon shattered by an emerging new enemy.",Fearless,Animation/Superhero,"August 14, 2020",89,4.9,English,True
52,s53,Movie,InuYasha the Movie 3: Swords of an Honorable Ruler,Toshiya Shinohara,"Kappei Yamaguchi, Satsuki Yukino, Koji Tsujitani, Houko Kuwashima, Kumiko Watanabe, Ken Narita, Akio Otsuka, Kikuko Inoue",Japan,"September 15, 2021",2003,TV-14,No data,"Action & Adventure, Anime Features, International Movies",The Great Dog Demon beaqueathed one of the Three Swords of the Fang to each of his two sons. Now the evil power of the third sword has been awakened.,Holiday Rush,Family film,"November 28, 2019",94,4.9,English,True
53,s54,Movie,InuYasha the Movie 4: Fire on the Mystic Island,Toshiya Shinohara,"Kappei Yamaguchi, Satsuki Yukino, Koji Tsujitani, Houko Kuwashima, Kumiko Watanabe, Noriko Hidaka, Ken Narita, Cho, Mamiko Noto, Nobutoshi Canna",Japan,"September 15, 2021",2004,TV-PG,No data,"Action & Adventure, Anime Features, International Movies","Ai, a young half-demon who has escaped from Horai Island to try to help her people, returns with potential saviors InuYasha, Sesshomaru and Kikyo.",The Day of the Lord,Drama,"October 30, 2020",93,4.9,Spanish,True
54,s55,Movie,InuYasha the Movie: Affections Touching Across Time,Toshiya Shinohara,"Kappei Yamaguchi, Satsuki Yukino, Koji Tsujitani, Houko Kuwashima, Kumiko Watanabe, Kenichi Ogata, Noriko Hidaka, Hisako Kyoda, Ken Narita, Tomokazu Seki",Japan,"September 15, 2021",2001,TV-PG,No data,"Action & Adventure, Anime Features, International Movies","A powerful demon has been sealed away for 200 years. But when the demon's son is awakened, the fate of the world is in jeopardy.",Airplane Mode,Comedy,"January 23, 2020",96,5.0,Portuguese,True
55,s56,TV Show,Nailed It,Unknown,"Nicole Byer, Jacques Torres",United States,"September 15, 2021",2021,TV-PG,No data,Reality TV,"Home bakers with a terrible track record take a crack at re-creating edible masterpieces for a $10,000 prize. It's part reality contest, part hot mess.",How It Ends,Action-thriller,"July 13, 2018",113,5.0,English,True
